tweet	label	language
እያባላና እያሣረደ ባላየዉም ሊገዛ ምክንያቱም መከላከያዉም ደህንነቱም ፍትሁም ምርጫቦርዱም ፖሊሡም በአክራሪ ኦሮሞ ስለተሞላ እነሡን እ…	neutral	amh
Hahahaha እንዲህ ነው እንግዲህ  ገና  ምን አይተሽ ይቀኛል ??	neutral	amh
ኢትዮጵያ ዉስጥ የግለሰብና የቡድን መብት መከበር አለባቸዉ ብዬ አምናለሁ -ሁለቱ መብቶች ሲጋጩ ግን የግለሰብ መብት መቅደም አለበት የሚል ጠንካራ አቋም አለኝ! ስለ…	neutral	amh
እንግዲህ በሉ ተሰባስበን ኢትዮጵያ እንሂድና ስለ እጽዋቶች የመስክ ጉብኝት አድርገን እንመለስ ??	neutral	amh
ሰው	neutral	amh
የየትኛው ክልል ልዩ ሃይል ናት......	neutral	amh
በየዩኒቨርሲቲው የእርስ በእርስ ግድያ፣ የሀይማኖት ተቋማት ውድመት ፣የህጻናት እገታ እና በየአካባቢው ያለው ስርአት አልበኝነት የተመረጠ መንግስት ካለመኖር ጋር…	neutral	amh
በዚህም ሰበብ ከፍተኛ ገንዘብ የሆ የህዝብ የመንግሥት እና የእራሴም ጭምር ከሰሮዋል። ነገር ግን አሁን በመጣው የሀገራችን የመንግስት አሰተዳደር ለውጥ የክልሉ መንግስ…	neutral	amh
ብልፅግና ፓርቲ በአገራችን ህልውና በሚፈታተኑት ላይ ቆፍጠን እና ቆምጨጭ ያሉ እርምጃ እና ውሳኔወችን ካሳለፉ ህዝቡ ከፓርቲው ጎን የማይቆምበት ምንም ምክንያት አይኖርም  በበኩሌ ሃላፊ…	neutral	amh
ፅኑ ሰዓቢ አለህ አንተ ምን አለብህ	neutral	amh
የሌሎች ከተማ ከንቲባወች መቸ ነው ከእንቅልፍ የሚቀሰቅሷቸው መሪወች መሪወችን ያመጣሉ እንጅ መንጋ መሰብሰብ ዘላቂነት የለውም!!!	neutral	amh
በአሞሌ ካልሆነ ብሎ ድርቅና!!!  ሰውንም ብሩንም ካልፈለጋችሁ ያው ተመልሰናል!!!	neutral	amh
በተለያዩ የመንግስት ከፍተኛ የትምህርት ተቋማት ተማሪዎች የነበሩ እና በግጭቶች ተሳታፊ ናቸው የተባሉ 170 ተማሪዎች ከአንድ አመት እስከ ዕድሜ ልክ የሚደርስ ዕገዳ እንደተጣለባቸው የ…	neutral	amh
ብልፅግና ፓርቲ በአገራችን ህልውና በሚፈታተኑት ላይ ቆፍጠን እና ቆምጨጭ ያሉ እርምጃ እና ውሳኔወችን ካሳለፉ ህዝቡ ከፓርቲው ጎን የማይቆምበት ምንም ምክንያት አይኖር…	neutral	amh
እኔ የምለዉ የአማራ አክቲቪስቶች ለኦርቶዶክስ  የኦሮሞ አክቲቪስቶች ደግሞ  ለሙስሊሙ ማነዉ ጠበቃ ያደረ ጋቸዉ ግን	neutral	amh
እውነት ነው እቱ አሜን??????	neutral	amh
ህልውና በኦሮሞ ሕዝብ እጅ ውስጥ ነው። ጃዋር ሞሐመድ  እውነት ወይስ እውነት?	neutral	amh
ሠላም Z	neutral	amh
ይቅርታ ጥፋቱ የኔ አይደለም ????! I blame the ጠጅ	neutral	amh
የዜና ርዕስ በሚል ቢስተካከል	neutral	amh
ማንነት ከዜግነት ፖለቲካ ጋር ተጣምሮ ካለተቀናጀ የሚሆነው የእኩልነት፣የአብሮነት፣የመታረቅ፣የመደመርና የመከባበር ፖለቲካ ሳይሆን የመነጠል፣የ…	neutral	amh
ኧረ መላ መላ  አላመጣው የለኝ አልቀላውጠው ዛሬስ ከነባልሽ ልትናፍቂኝ ነው!!	neutral	amh
ለ በዳኒኤል ብርሃኔ በኩል የተለቀቀ የህወሓት ይፋዊ የመልስ ምት ለዶክተር አብርሃም በላይ	neutral	amh
በደምብ ይታወቃል እንጂ ሲራኩ። መቼና እንዴት እንደተተረጎመ ማን እንደተረጎመዉ በግልፅ የሚታወቅ ነዉ።	neutral	amh
... አክዓብ ከእርሱ በፊት ከነበሩት ሁሉ ይልቅ በእግዚአብሔር ፊት ክፉ አደረገ ... የሲዶናውያንንም ንጉሥ የኤትበኣልን ልጅ ኤልዛቤልን አገባ፥ ሄዶም በኣልን አመለከ ሰገደለትም።…	neutral	amh
አቡበከር አህመድ ችግሩ ከመፈጠሩ በፊት ለደመቀ መኮነን ፣ ለዳንኤል ክብረት እና ለክልሉ ፀጥታ ዘርፍ ሀላፊ እንዲያስቆሙ ደውሎ ነግሯቸው ነበር!!  ኡስታዝ አህመዲን ጀበል Ltv…	neutral	amh
ኃጢያታችንን ብንናዘዝ ኃጢአታችንን ይቅር ካለን ከክፉም ሁሉ ያነጻናል እርሱ (ኢየሱስ ክርስቶስ) ታማኝ እና ትክክለኛ ነው። 1 ጁዋን 1 -9 ?? ??	neutral	amh
በቤተ ሰማእቲ በቁፋሮ የተገኘው ጥንታዊ ከተማ | DW | 05.01.2020	neutral	amh
እናንተ!!! ለ አንዳንዶቻችሁ ነገ መግቢያ አንድ አንድ እና ከዚያ በላይ መፅሐፍ እንደሆነ ታውቃላችሁ አይደል?  በሉ ይዛችሁ ከች በሉ!	neutral	amh
የመጀመሪያውን ለመናገር አውሮፕላኑ ላይ ለመቆየት ይችላል ይዴይሜ	neutral	amh
?????? ድንጋይ ከመወርወር የተሻለ ነው መቼም	neutral	amh
ህዝብ በሚለው አልስማማም ። እንደሰው ሁሉም ዓይነት በሀሪዎች አሉን ።	neutral	amh
ይሄን ስታይ የሻንቅላ ጦርነት ማስነሳቷ አይቀርም ብዬ ነው	neutral	amh
ሰላም ግንባታ ምንድንነው? ስለ ሰላም ግንባታ መሰረታዊ ትውውቅ (introduction) ማወቅ ለምትፈልጉ ሁሉ ያላችሁን ጥያቄዎች በትዊተር DM ብታደርጉ በተቻለኝና ጊዜ በፈቀደ መጠን…	neutral	amh
የድሃ ልጅ ጭቅላት የሚቀላ የእሱም ጭንቅላቱ ተቀልቆ መገደል አለበት  ሃዘናችሁ  ሀዘኔ ነው	neutral	amh
ባልተለመደ መልኩ በርከት ያሉ ሴቶች ስልጣን ላይ በሚገኙበት ወቅት የብዙ ሴቶች እገታ ችግር አለመፈታት የሚገርም ነው።  ፍትህ ለታገቱ እህቶችና ወንድምች!!!!!  Please give…	neutral	amh
?? ?? ?? እውነትኮ ነው:: አሁን የኛ ሰው ጠፍቶ ነው!አይነት ነገር!	neutral	amh
በመስጠት ማወቅ Stitch2503 ተጨማሪ ሰዎችን አሉ ሆኗል	neutral	amh
ትንሽ ጠበብ ብለህ መመካት አይቻልም እንዴ!????	neutral	amh
ሰንበትን በተስፋ ለህፃናት በጎ አድራጎት:  ይህ በጎ አድራጎት ድርጅት በወ/ሮ ወይንሸት ከ19 አመት በፊት የተመሰረተ ሲሆን በኤች አይቪና በተለያየ ምክንያት ወላጆቻቸውን ላጡ ህፃናት…	neutral	amh
ውነቱን የ ኢትዮጵያውያን ኣስተሳሰብ ከሆነ ደሞ እጅ ወደላይ ማረጉን ተለማመድ እሱ ነው የሚያድንህ እንደቀድሞው ??????	neutral	amh
ፓፓጽ ፍራንሲስ ይህን የNewYear ምልክት ስለ የሴቶችን ቤተሰባዊ ጥቃት ከማውገዛቸው ትንሽ ሳት በፊት አንድን ሴት ስትይዣቸው ለማስለቀቅ ብለው እጅዋን በጥፊ መተዋል	neutral	amh
ዶ/ር ጌታሁን፦ ሁላችሁም ለሰራችሁት ትልቅ ስራ እና ገድል ከልብ አመሰግናለሁ፤ ምንም መዘናጋት ሳይፈጠር የበለጠ በውስጣችሁ የያዛችሁትን እምቅ ሀብት ለእምዬ ሀገሬ የ…	neutral	amh
መደራጀቱ የውድ ሳይሆን የግድ ነው!!	neutral	amh
ወክላ 2ኛ የወጣችውን ኢትዮጵያዊቷን ለተሰንበት ግደይን ትቶ ሆላንድን ወክላ 1ኛ የወጣችውን ሆላንዳዊት ሲፈን ሃሰንን የሚያንቆለጳጵስ ትውልድ የተፈጠረብሽ ኢትዮጵያ እንዴት አደርሽ?…	neutral	amh
ኤርሚያስ ለገሰ  አሜሪካ ቁጭ ብለህ ስለ አዲስ አበባ የሌለ የውሸት ታሪክ ለእነ እዝቃዬል ጋዲሳ ስትቀደድ ኢዜማ በአንድ ኢትዮጵያዊነት በመላው ሀገሪቷ አደራጅቶ እየጨረሰ ነው  ደሞ ምን ብለህ ትተረተር ይሆን	neutral	amh
የ2012 የኢትዮጵያ ፕሪምየር ሊግ ዛሬ ተጀምሯል።   - የውድድር ዘመኑ የመጀመርያ ጎል፣ የፍፁም ቅጣት ምት ጎል፣ በራስ ላይ የተቆጠረ ጎል፣ ቢጫ ካርድ እና ቀይ ካርድ የሚከተሉት ና…	neutral	amh
ስራን ለነገ ማቆየት አስፈላጊ አይደለም why wait?	neutral	amh
እናቴ ኢትዮጵያን ሳስብ ነው ያሳለፍኩት	neutral	amh
የ???? ታሪክ እውቀት በተስፋፋበት ዘመን፣ ቴክኖሎጂ በተራቀቀበት ወቅት የነበረ አልያም ትላንት የጀመረ ስላልነበረ ግላመረስ ላይሆን ይችላል፣ ነገር ግን ስህተት ለማ…	neutral	amh
ኃጢያቶችህ ይቅር የማይባሉ ናቸው ነፍስህ ትጠፋለች እናም ትውስታህ ከርሱ ጋር ትሆናለች - cላክ የሁሉም ገሃነም ፍጥረታት ሁሉ ጠበቃ ነው	neutral	amh
በመለስ ዜናዊ መታሰቢያ ፓርክ ውስጥ ከሚገኙት አገር በቀል ዕፅዋት መካከል አንዱ የሆነውን እሬት ሳይንሳዊ ይዘቱንና ጥቅሞቹን እናስተዋውቃችሁ፡፡	neutral	amh
No  ሥእል መውደድ የነጭ ብቻ ያረገው ማነው?	neutral	amh
ከስደት አንዱ መጥፎ ነገር በቅርብ የምታውቁትን ሰው እንደ ቀላል ሞቱን የምትሰሙበት ሁኔታ ድንገት በSM ነው ድንጋጤ አያስለቅሳችሁም ምን ማለት እንዳለባችሁ እንኳን አታውቁም!!	neutral	amh
የሲዳማ ሕዝበ ውሳኔ ኢትዮጵያ እየሄደችበት ያለውን የዴሞክራሲ ጎዳና አመላካች ነው ብለዋል ጠሚው። ጥሩ ነው። ትልቁ ጥያቄ የዲሞክራሲ ጎዳናው የክልልነት ጥያቄ ያቀረቡትን ሌሎቹን የደቡብ ዞኖች ያልፍባ…	neutral	amh
አይ እንደዛ ማለቴ አይደለም ቤተ።በተደጋጋሚ የፖሊሲ አረፍተ ነገሮች የሉትም (ቢያንስ የመጀመሪያ 5ቶች) ብዬህ ነበር።አለ ካልክ…	neutral	amh
በእስክንድር ነጋ በሚመራው የአዲስ አበባ ባለአደራ ምክር ቤት የሚመሰረተው ፓርቲ ስያሜ ባልደራስ ለእውነተኛ ዴሞክራሲ የሚል ይሆናል።	neutral	amh
ሰሞኑን ዌብ እድሳት ላይ ነበሩ አሉ:: አሁን ግን እየሰራ ነው	neutral	amh
በወያኔ የጭካኔ እስር ቤት በነበርክበት ጊዜ ሻማ አብርቻለሁ፤ ተሠልፌ ጩኸቴን አሰምቻለሁ፡፡ አሁን ግን በምታራምደው መጨረሻውን ግልጽ ባልሆነ፣ የኢትዮጵያን ያለ…	neutral	amh
እናት ሥለተመሠከረላት ጀግና ነች እሧ እማ ባትኖር ጎዶቹ ጉድነበር እናት ሜታ ዳታ የቢራቢሮ ያክል ነች የክፋት ትብብራቸውን የደረመሠች የምትደመርሥ እናት እማ የጀግና ጀግና ነች አገር…	neutral	amh
የ እንስሶቹ ፌደራሊዝም ለሰዎች አይሰራም .. .. ስለዚህም ገዝግዘን ፤ አፍርሰን  … .. ሰዎችን በሚመጥን ፌደራሊዝም እንተካዋለን ..	neutral	amh
የብሔሩን መሰለኝ። እንዴት እንደሚገናኝ ግን እንጃ። cause-effect relation ይስጠላሃል። :)	neutral	amh
ቱሪናፋ!   ያለንበት ወቅት የቁርጥ ነው እነዚህ ኃይሎች ወይ ከትግራይ ሕዝብ ጋር ይሠለፋሉ አልያም ጥግ ይይዛሉ። አሠላለፉ መለየት አለበት፣ አለበለዚያ በትግራይ እንለኩሰዋለን ባሉት…	neutral	amh
የፈረንጅ ክሪስማስን አያከብርም። እኛ በቀኝ ግዛት ያልተገዛን ኩሩ ህዝቦች ነን! የራሳችን የቀን መቁጠሪያ ያለን ድንቅ ህዝቦች...✊ አለ ሳሎኑ መሐል ላይ የተከላት የክሪስማስ ዛፍ ላይ ፊኛ…	neutral	amh
ሮሜ 14 (Romans) 17፤ የእግዚአብሔር መንግሥት ጽድቅና ሰላም በመንፈስ ቅዱስም የሆነ ደስታ ናት እንጂ መብልና መጠጥ አይደለችምና።	neutral	amh
በጦርነት መሃልም ምርጫ ተደርጎ ያዉቃል በአለም ታሪክ	neutral	amh
ዛሬ ጠዋት በተካሄዱት የኦሮሞ ዴሞክራሲያዊ ፓርቲ (ኦዴፓ) እና የአማራ ዴሞክራሲያዊ ፓርቲ (አዴፓ) አስቸኳይ ስብሰባዎች ሁለቱም ውህደቱን በሙሉ ድምጽ አጽድቀዋል::   ከብልጽግና ጋር ወደፊት!	neutral	amh
ስሜን ወሎ ዞን ግዳን ወረዳ (የቀድሞው ላስታ አውራጃ አካል ነው)… ትምህርትቤቶቹ የሚገኙት በወረዳው ወንዳች ተብላ በምትጠራው አነስተኛ የገጠር ከተማና ብርግነት…	neutral	amh
ሀ ! ብለል ፊደል ቆጥረህ ስታበቃ ሀ ¡ ረስተህ ቁቤን ከላይ ደረደርክ አይ ፍትሀዊ የፊደል አጠቃቀም የማያውቅ ፍትህ ላይ ቂብ ያልክ የመጀመሪያው ፍጡር??	neutral	amh
የእኔን የወንድሜን የእህቴን የእናቴን የአባቴን የጎረቤቶቼን የአካባቢዬን የከተማዬን የሀገሬን ደህንነት መጠበቅ ግዴታው ነው። እነዚህ ሁሉ ሲጠበቁ ተማሪዎቻችንም ይጠበቃሉ።	neutral	amh
አቃቂር 2 እውነት ነው አህመዲን ሞጣ አልሄደም ሞጣ ነው አህመዲን ጋር የመጣው አሉ ????	neutral	amh
ከለውጡ በዋህላ ሁሉም አዋቂ፥  ሁሉም ጀግና እና ፖለቲካ ተንታይ ነኘ ባይ ሆነ፥ አንዳንድ ጊዜ የ አፍሪካ መሪዎች ወደው አይደለም Dictators ሚሆኑት እንደዚህ አ…	neutral	amh
የኔ ሳይበላሽ ወር አለፈው። ቀላል ስኬት አይደለም ??	neutral	amh
ለመጨረሻ ጊዜ ላጀናጅናት የነበረችቱን ካገባኋት ወዲህ እርግፍ አድርጌ ትቼዋለሁ ??????	neutral	amh
ቴሌቭዥኑ ሱራፌል ወንድሙ ከኦሮሞ ነፃነት ግንባር ሊቀ መንበር ዳውድ ኢብሳ እና የኢዜማ መሪ ብርሐኑ ነጋ ጋር ለቃለ መጠይቅ ተቀምጧል። ሱራፌል ስለሆነ የሚረባ ነገር ብንጠብቅ አይከፋም…	neutral	amh
“ከሱስ መውጣት ከባድ ነው” ለሚሉ ሰዎች ትልቅ አርአያ??	neutral	amh
አንቺ በታክሲ አትሄጂ የት ደረሱብሽ! ደሞ አገር ቤት ገባሽ እንዴ?	neutral	amh
ወ/ዊ ሰላም ላንተይሁን!  ትናንት ምሽት በኤልሻዳይ ቴሌ. የቤተሰብ ፕሮግራምህን ከባለቤቴ ጋር በመሆን ተከታትያለው:: ወትሮም ቢሆን የ30 ደቂቃ ትምህርትህ ላላጠ…	neutral	amh
ከሚቀጥለው ሰኞ ጀምሮ በሚኒስትር መስሪያ ቤቶች ደረጃ አዳዲስ ሹመቶች እንደሚኖሩ ከወደዛው አካባቢ ወሬ ሰማን	neutral	amh
የመንደር ሽፍታ አሸነፈው! ድንጋጤው አለቀቀውም ደርግ ቀይሽበር EDU ኢሓፓ እያል ሲገለው ወያኔ ነፍጠኛ እያለ ሲያሽማቅቀው   ሌሎቹም በኢኮኖሚ እንዳይታትር በፖለቲካው  ነቃ ብሎ እን…	neutral	amh
የመጨረሻ እስትንፋሳ እስኪያደርጉ ድረስ ከፍተኛ ሥቃይ ይሰማዎታል ፣ የደምዎ መስመር ይሰቃያል እናም ከሞተ በኋላ ወደ ሲኦል ዋሻዎች ይገባል። ከሠራው ኃጢአት እራስዎን ለማዳን ምንም ማ…	neutral	amh
ከድርጅት ህልውና እና ከግል ጥቅም በላይ በማያስቡ አድርባዮች የተሞላ ፓርቲ መለኮታዊ ሃይል ካልሆነ ለቀጣዩ ምርጫ አማራጭ ሆኖ ለመቅረብ የሚያስችለው የመዋቅርም ሆነ የርዮተ-ዓለም ለው…	neutral	amh
እንዴ ጭራሽ ትዊተር ላይ አንያችሁ ነው?	neutral	amh
መኪና አስመጪዎች በረቂቅ ኤክሳይስ ታክሱ ዙርያ መግለጫ ለመስጠት ሚድያ ጠርተው የነበረ ቢሆንም ፍቃድ አላመጣችሁም ተብለው እንደተከለከሉ ገልፀዋል!	neutral	amh
ዲን ዳንኤል ክብረት ስለ ፍቅር ያስተማረው ክፍል ሦስት	neutral	amh
ጥቁር በአማርኛ	neutral	amh
የተለያዩ የአረብ ሀገራት የውጭ ጉዳይ ሚኒስትሮች በሊቢያ ወቅታዊ ጉዳይ ላይ ውይይት አደረጉ	neutral	amh
ቆይ ግን ሚሊኒየም አዳራሽ ብግባ ሳልረጋገጥ እተርፋለው	neutral	amh
ያ ?? ግለሰብ የአማራ ክልል መንግስትን በአክትቪስትና በአክራሪ የኦርቶዶክስ ህገወጥ ተግባርና አሳፋሪ የእምነት ነፃነት በመጠበቅ ረገድ መልካም ነበር ማለት ይቻላል::❓	neutral	amh
የኢትዮጵያ ሙስሊሞች ብሎ አላለም አገራችን ድሮም አሁንም በተለይም በአባይ ውሀ  ምክንያት ጠላቶች እንዳላት የታወቀ ነው ! ነገር እየስነጠቁ ህዝቡን…	neutral	amh
እንደውም ወደፊት ፀባዬ ተሻሽሎ ውሻ ከወደድኩ እና ካሳደኩ ሳላስፈቅድህ ሁላ አቦል ብዬ እንደምጠራው ቃል ገባለሁኝ።	neutral	amh
ሀሚልተን ቲቪ ይክፈቱ  አሁን ጀበሉ ንግግር በማድረግ ላይ ነው	neutral	amh
መጀመሪያ ተወዳደሩ ሳይለን ??	neutral	amh
ሕፃን ልጅ ናት ብዬ ጭኔን ባንተርሳት እንቅልፍ ወሰዳት እውነትም ሕፃን ናት ??	neutral	amh
5- ከየትኛውም ክልል የሚመጣ ተማሪ ከሌላው ክልል ተማሪ የተሻለ ህይወት የለውም:: ቢኖረው ኑሮ ሀገር አቋርጦ ሌላ ቦታ አይሄድም ነበር:: በአጠቃላይ ከደህንነት ለመውጣት የሚጥር ድሃ…	neutral	amh
ወይ ዝቅጠት  ......???!!!  ሀገሬ እንደ ብራዚል ሆና ??!!!  ፖሊሱንስ መች ይፈሩታል ?? ከጎን ለጎን አብሮ እየሄደ ??!!	neutral	amh
ብር ቢሆን አሪፍ ነበር	neutral	amh
እንዳቺ ስንት አይነት ሰው ቢኖር ነው የደም አይነት የተጠየቅሽው	neutral	amh
አስተያየት መስጠት ላይ ትምሮ የግዕዝ ቁጥር ማንበብ ላይ ድፍሮ ነሽ መሰለኝ ጀለስ ?? ለማንኛውም ደግመህ አስተያየት ከመስጠትህ በፊት የለጠፍኩትን ደ…	neutral	amh
???? የሚያጠግብ እንጀራ ከምጣዱ ያስታውቃልና ፈጣሪ አምላክ የብልፅግናችንን ደስታ ለዘላለም አፅንቶ ያኑርልን። አሜን!  ❤????ጥሌ-ዘመቂ	neutral	amh
ሳይጨብጥ  ሰው ሳያስገድል ፣  መንገድ ሳይዘጋ እልፉን ነፃ አውጪ ፣ አእላፉን መንጋ አንቀጠቀጠው ፣  እስክንድር ነጋ ። ድል ለዲሞክራሲ ✊??✊??✊??????❤️  ድል ለኢትዮጵያ ✊??✊??✊??…	neutral	amh
ጉድጓዱን እና የቧንባ ስራዉን ጨምሮ 2000000ብር	neutral	amh
4000 is needed. አቦ ሌሎቹ እቁብ ቦታ ሄደው ነው ብለህ ተመዝገ።	neutral	amh
ነጋን እንደምትፈሩ እግዚአብሔርን ብትፈሩ የት በደረሳችሁ። ያው ግልጽ ጦርነቱ በይፋ ተከፍቷል። እስኬው የአንድ ሺህ ሰው ግምት እንዲህ አንቀጥቅጥልኝ።	neutral	amh
እስከ አሁን ድረስ ከ100 ቦታዎች በላይ የተቃውሞ ሰልፎች ተደርገዎል ።ሚሊዎኖች አደባባይ ወጠዎል። የህዝብ ድምፅ የሚሰማው ስንት ሲሞላ ነው?!…	neutral	amh
I will ኣያዋ ብጣዕሚ ልገርም ትሕትና ለለዎ መኽበሪ ሰብ ጭዋ ቆልዓ እዬ.ብቀደማይ ታይ እዪ ስኻ ልባዕልኻ ብተክሊል ተ…	neutral	amh
ቪድዮውን እየው ታሪኩ ፊልም ነው የሚመስለው	neutral	amh
ሚስት እንደ እጅና እንደ ዓይን ሊሆኑ ይገባል።እጅ ሲጎዳ ዓይን ሊያለቅስ፥ ዓይን ሲያለቅስም እጅ እንባን ሊያብስ ይገባል።  ቅዱስ ዮሐንስ አፈወርቅ ??	neutral	amh
እኛ እኛ ማን መሆን አያስፈልገንም ልላችይ ትየቆመለ ይላ ኑላፕሮውአ ርገናመለ ንውያሪመጀመየ ቀጥሎ መሞከር የሚፈልገው ማን ነው ልጋልፈስያ ርገነ ኝሳወ ልህያ ቅለጥመለ	neutral	amh
ዛሬ ማታ ዶሮ ለመሥራት እየተሠራ መሆኑ ተገለፀ??	neutral	amh
ATV: ቃል ምስጋናን መብርህን ኣማኑኤል ኢያሱ ብዛዕባ ቅብጸታዊ መጥቃዕቲ ዕሱባት ህግደፍ	neutral	amh
የኢሕአዴግ አባል የነበሩ ድርጅቶችና አጋሮች በውህደት አዲስ ፓርቲ የመመሥረት መብት ቢኖራቸውም ኢሕአዴግን መውረስ አይችሉም፤ አቶ ጌታቸው ረዳ	neutral	amh
ክስ ተመስርቶባቸዋል??	neutral	amh
ክትክታ ደሞ እኔ አላውቅም???♂️	neutral	amh
እኔ ራሱ እኮ የረብሻ ብህሪያ በድፍረት የወጣችው ዚን እንዳሻው ሲሆን አይቸ ነው	neutral	amh
2)ከቀረጥ ነፃ ሲሆን ከአገርውሥጥ ግን ቀረጥ ከፍለን በገባ ወረቀት አትመን ተወዳዳሪ ሊያደረግን አልቻለም ለሚባለው ቀረጥ ከፍለው የገባና መፀሀፍ ሢያትሙ ላተሙት መፀሀፍ ብቻ የከፈሉት…	neutral	amh
እንዴ!???? እነዚህ ቃላቶች ለካስ ሌላ ትርጉም አላቸው	neutral	amh
የኔ ቆንጆ በተለይ ነጭ ልብስ አትልበሺ  ????	neutral	amh
ከእኛ ሳተላይት የተገኘ መሆን አለበት ይህንንም ??	neutral	amh
ዳቦ 3 ብር ገብቷል ለማለት ነው አመሰግናለው!	neutral	amh
አሁን የፍርሃት ጊዜ አይደለም ሃአ የእኔ ሰዎች	neutral	amh
ተፃራሪ ሀቅን መርጦ መተው ከመዋሸት በምን ያንሳል? ለበጎስ ስራ እውቅና መስጠትስ ውዳሴ የሆነው እንዴት ነው?   ጋዜጠኝነትህን መጥቀሴ የሙያውን መሰረታዊ መርህ ጠንቅ…	neutral	amh
ለጠላ ያለኝን ፍቅርን አማልክቱም ያውቃሉ እንደው እኔንም አትርሳኝ	neutral	amh
?? እኔ የረጅም ጊዜ ብሶቴ ነው አሁንም  ተዉኝ ??	neutral	amh
የጁሀር ስራ ነው። ጭራሽ ብሎ ብሎ ቀኑን ገለባበጠው??	neutral	amh
በፍጹም የኢትዮጲያ ህዝብ ጠንቅቆ አውቋችዋል በቃን ፍቱን  ትክክለኛ ለውጥ እንሻለን  ለሌላ ባርነት እስር ግድያ አንዘጋጅም።	neutral	amh
ቱግ ብዬ አላውቅም!! አሉባልታ ያለመረጃ ማውራት እንጂ ስድብ አይመስለኝም፡፡ ወደ ስድብ ሮጠህ ከመግባትህ በፊት ያልክበትን…	neutral	amh
የመጀመርያ ሰሞን ጨዋታዎች ለአዲስ አሰልጣኞች እንደ ጫጉላ ነው ሞይስም በዌስትሀም 4 አግብቶ ረምርሟል ...የመጀመሪያው አጋማሽ አርሰናል ግማሽ ምርጥ ነው ግማሹ ጉብዝናው በሙሉ ደካማው ማንቼ ተሸፍኗል	neutral	amh
ወረዳ ታግተው ከነበሩ ታዳጊዎች የ7 ኛው ህይዎት አልፏል። በአጋቾቹ በጥይት ተመቶ ቆስሎ የነበረው ታዳጊ በጎንደር ሬፈራል ሆስፒታል የህክምና እርዳታ ቢደረግለትም መትረፍ አልቻለም።…	neutral	amh
መንግስት የለም የሚያሰብል ብዙ ወንጄል አይተናል። የደምቢ ዶሎው የእህቶቻችን እገታ ግን በመንግስት ላይ ተስፋ አስቆርጦኛል። በቦኮ ሃራም አለም የተጠየፍነው ወንጄል እዚህ እስኪደርስ…	neutral	amh
ወር ያህል ቆይተሽ አልሰጥም  ትያለሽ? ያን ዳሌ ተሸክመሽ?  ከንፈርሽን አሞጥሙጠሽ ይህ ምስኪን እባክሽ ስጪኝ ሲልሽ ድምፅሽን ከፍ አርገሽ አልሰጥም ትያለሽ እንች ልጅ በጣም ክፍ ነሽ።	neutral	amh
????????THE YEAR OF REVIVAL!!????????  ሶምሶንም ስለ ሁለቱ ዓይኖቼ ፍልስጥኤማውያንን አሁን እንድበቀል፥ እግዚአብሔር አምላክ ሆይ፥ እባክህ፥ አስበኝ፤ አምላክ ሆይ፥ ይህን አ…	neutral	amh
እንስቶች በተፈጥሮአቸው መኖር(ሴኩሪት) ነው የሚፈልጉት::የተሻለ ካገኙ ያን ሚሰጥ ለሌላው ነገር ግድ አይላቸውም::	neutral	amh
ሃጉለሀሰን (የሃገሬን ጉብል/ጉብሊት  ለሀገሬ ሰው ንቅናቄ ) ???????? ካስሽ የኔና ያንተ ፓርቲ	neutral	amh
ይኸንን መንፈስ ማወቅ ለሚታለመው ዲሞክራሲ ስኬት ወሳኝ ነው	neutral	amh
ያሳዝናል በጣም ድል ለዲምክራሲ	neutral	amh
