tweet	label	language
ምን ባለሙያ አላችሁ ብለህ ነው። ዱኩላ	negative	amh
ለኃጢያትዎ ይከፍላሉ ፡፡ ከኋላዎ እየተሽከረከሩ እና ድንቁርናዎን እንደሚሰርቁ ከኋላዎ ይመልከቱ ፡፡ ለድርጊቶችዎ ትጮኻላችሁ ፡፡	negative	amh
ዛዲያ ድርጅታችኹ መታገታቸውን ከሰማ ጀምሮ ምን ሲያደርግ ነበር?  ከሕዝብ እኩል እዚህ ላይ ስትጠይቁ አታፍሩም? ነገ ብልጽግና ምናምን እያላችኹ ታወራላችኹ ልሳናችኹ ሳይታሠር?	negative	amh
ለአማራ ህዝብ ተስፋ የሚባሉት ተቋማት ለማፈረስ ተግቶ የሚሰራ፣ አውርጃዊ አስተሳሰብ ያለው ለህዝባችን አንድነት ጸር የሆነ ድርጅት ነው። አዴፓን ከአማራ ህዝብ ትክሻ ላይ ማውረድ የክ/ዘመኑ የአማራ ህዝብ ረፍት ነው።	negative	amh
እውነት ሊሆን ይችላል። እናንተ እኮ ከመስራት ይልቅ ሌላውን ማማት እና መጣል ላይ ታተኩራላችሁ??	negative	amh
ድጋፍ መሆኑ ነው?	negative	amh
በሚልዬን የሚቆጠር ሕዝብ የጃዋር ተከታይ ከድንጋይ በታች ማለት ነዉ?  አይ የናንተ ምላስ!! ብቻ አብቅተዋል. ብዙ ማለት ትችላላችሁ. ሌላው የተስፉ መቆረጥ ምልክታቹ ነዉ	negative	amh
አሁን ሁለት ሰዎች በኢትዮጵያ ታሪክ እንደ ዐቢይ ያለ ቅን መሪ አልነበረም የሚል ሀሰት ወሬ ሲያሰራጩ ተገኝተው ከገፄ በBlock ተባረዋል።  ተመሳሳይ እርምጃዎች ተጠናክረው ይቀጥላሉ??	negative	amh
2.እኚህ ወለጋዎች ሸዋ ሳይገቡ፣በሕዝብ ፊት ስቀሏቸው እና እርም አስብሏቸው። ~ ቀ/አፄ ኃይለስላሴ	negative	amh
የድሮ ኬዝ ይሆናል እንጂ መቼም ከኔ ጋር አይገናኝም ኣ ሳጅን?	negative	amh
የቁም ቅዥት እያለማችሁ እንዳይመሽባችሁ ስሩ እውነት ተናገሩ ከቅዥት...000000	negative	amh
ምን አይቶ ነው ግን?!????????	negative	amh
ህወሓትን የሚጠሉ ሰዎች ህወሓት ብልፅግናን ባለመቀላቀሏ የሚናደዱት ነገር ነው አልገባህ ያለኝ። ??	negative	amh
ድሮም ጠርጥሬ ነበር ቀልቃላ ቢጤ ነች ????	negative	amh
ህውሀት አልዋህድም አለች ተብሎ በተለይ ደግሞ በአዴፓ ደጋፊዎች መደናገጥ እየታየ ነው ምረቱን ያውርድላቹሁ፡፡	negative	amh
አይንህ roll ለማድረግ አይመችም	negative	amh
ለውጥ ከሚባለው ነገር የሚያበሳጨኝ በህዝብ ላይ ግፍ የፈፀሙ ሰዎች ምንም እንዳልሰራ አሁንም የመንግስትን ስልጣን ይዘው መቀመጣቸው ነው የግፉአን ደም ይጮሀል ።	negative	amh
ችግሩ ኦነግ ከነትጥቁ መግባቱ አይደለም። ችግሩ ፍትሃዊ የሆነውን የወለጋን ክልል የመሆን ጥያቄ ለማፈን መሞከሩ ነው። የወለጋ ክልል የመሆን ጥያቄ በአፋጣኝ መልስ ማግኘት አለበት።	negative	amh
ምክንያቱም በዚህ ወቅት ቀላጺነት ብቻ ትርጉም አልባ እንደሆነ ስላየን	negative	amh
ዐቢይ ግልጽ ልሁንና ከዚህ የከፋ ኢትዮጵያዊነትን የሚያጥላላና ዝቅ አድራጊ ሥራና ጉዳይ ስለሌ፣ የውጭ ጓደኞቼ መንግሥት እንዴት ይህ ሥልጣን ይኖረዋል ጥያቄያቸው፣ ያለኝ መልስ እኔኑ ያ…	negative	amh
ሃገር አይገዳቸውም ሃብት እንጂ !! ምን አይነት ልክፍት ነው???	negative	amh
አንቺ ዱቄታም መቼ ያነበብሽው ታሪክ አለና ነው 615 ያሽው ደብተራ የነገረሽን እንጂ። እስክንድር ደሞ ወያኔ ጥፍሩን እና ፀጉሩን ሲነቅለው ማንነው ያስፈታው?	negative	amh
የሳተላይቷ ሚና !!! ~~~~~~~~~ በደንቢ ዶሎ ለታገቱት ወገኖቻችን የኛዋ ሳተላይት ሚና ምን ይሆን፣ ይሰራባት እንጂ ??	negative	amh
ሰይፉ ግን ዛሬ በጣም አመሸ ቤት ሚስቱ አትቆጣውም እንዴ? ??????	negative	amh
ህወሀት ከብልፅግና ልማትን መርጣለች :)  ኢዜማ በአሯሯጭነት ከብልፅግና ጋር እንደቀጠለ ነው :p	negative	amh
2/2 የስብሰባ ዝግጅት ቢኖረም ከላይ በመጣ ትህዛዝ በሚል በቅድመ ስምምነት የተከፈለ አዳራሽ ከህግ አግባብ ዉጪ  በመንግስት ጥብቅ መመሪያ ተሰብሳቢዉ በመግቢያ በር ላይ ለመሰብሰብ ተ…	negative	amh
ብጀምር እኔ አንተን እደብቅሃለሁ? ??	negative	amh
በሐገሪቱ በሚፈጠሩ ችግሮች ላይ እየመረጡ ያወግዛሉ፣አንድ ህዝብ ላይ ጥላሸት ይቀበሉ ሌላውን ባላየ ያልፋሉ	negative	amh
ኢዜማ ዋነኛ መንገድ የተበደለን መውቀስ፣የተከራየውን ሆቴል ከከለከሉት የት ይግባ?	negative	amh
ይሄ ቅዠታም ገና ምን የማይለው አለ ብለህ ነው ። ምረጡኝ ለማለት የሰራው መልካም ነገር ስለሌለ መቼም በኢትዮጵያ ያልተነሳ የለም ዘንድሮ ወደ እኛው ዞሩ ፈያመካ በልልኝ	negative	amh
ህወሓትን የሚጠሉ ሰዎች ህወሓት ብልፅግናን ባለመቀላቀሏ የሚናደዱት ነገር ነው አልገባህ ያለኝ። ?? ህወሃትም ብልፅግናንም ገደል ይግቡ	negative	amh
አመት ሙሉ ፓርቲና መንግስትን ደባልቀዉ የተጠቀሙበትን በቢሊዮኖች የሚቆጠር የግብር ከፋይ ገንዘብ ከነወለዱ 4ቱም ድርጅቶች መክፈል አለባቸዉ! በተለይህ ህወሓት! እንዴት…	negative	amh
አንድን የጦር ጀነራል በመንገድ እና ውሃ ስራዎች ላይ መድበህ በተመደብክበት ስራ ስትል ትንሽ አታፍርም። ወንድም አድርባይነትም ልክ አለው።	negative	amh
የተናቀ እንደተባለው ነው...	negative	amh
ከብሔርተኝነትና  ያልፀዳ ምርጫ ፍትሀዊ ሊሆን አይችልም ።	negative	amh
እስከው አንተ ጎጥ ራስ በቁጭት ተገፋፍተህ እንኳን አደረሳችሁ ስላልን እኛም በቁጭት እንኳን አደረሰህ ብለነሃል። እናም ከእብደትህ ፈጣሪ ያድንህ	negative	amh
ረዳቶቹ ሴት ቢሆኑ ኖሮ ፓርቲ ትቀይራለህ	negative	amh
ይህ ነው እንግዴ ማንም እየገባ የሚባርቅበት ሚድያ።ሱራፌል??	negative	amh
ምርጫውን ይኸው በአፈና ጀምረናል... / ሆኖም፣ ባልደራስ ለእዉነተኛ ዲሞክራሲ ፓርቲ  በመንግሥት ተፅእኖ አዳራሽ ቢከለከልም ሜዳ ላይ ተወልዷል... / ከፊት ለፊታችን መራራ ትግል ይጠ…	negative	amh
የሰይፉ ቀልድ አላዋቂነት እና በሁሉም ሰው መቀለድ እንዳለ ሆኖ በሰብአዊነት ለመርዳት ስላደረጋቸው ተግባሮቹ ግን ምስጋና እንጂ እንዲህ ማንጓጠጥ አይገባውም::	negative	amh
ኢምፔሪያሊዝም የሚለውን ሀሳብ ለመትከል የፈለግክ ዘር ነህ	negative	amh
ህዳር 21/2012 በዕለተ አክሱም ፅዮን ማርያም የአድዋው ሰይጣን ህወሃት ግብዓተ መሬት ተፈፀመ። RIP ህወሃት!	negative	amh
ንቅል?? መጀመሪያ በመፅሃፉና በመፅሃፉ ቅዱስ ያለውን ለውጥ እወቅ ሲቀጥል ዥልጥ ሰው አይመቸውም ??????	negative	amh
ምነው ቀልዱን ንፁሀን ላይ ባናረገው	negative	amh
ዝባዝንኬ ነው ያወራው። ሽፍቶቹ አንድም ፖለቲካዊ ግብ ይዘው ጫካ እንዳልገቡ ሁሉም ያውቃሉ። ከመነጠል ይልቅ ለክፉ ቀን መጠባበቂያ እንዲሆኑ እያባበሉም እያሰታጠቁም ማቆየቱን የመረጡት እነርሱው ናቸው።	negative	amh
አባቶችህ አለቀሱ።  የወደፊቱ ትውልዶችዎ ይወገዳሉ።  የራስዎን እና በአካባቢዎ ያሉትን ሰዎች ዝና ያበላሻል ፡፡  እግዚአብሔር በነፍስህ ላይ ይምራ ፡፡	negative	amh
እኔን ብቻ ነው ዶሮ ?? ለሊቱን አላስተኛም ያስባለው?	negative	amh
1923 ህገመንግስት ላይ አለ የለም የሚለውን ዛዛታ ተውትና   አረመኔው እስላሙ ፈላሻው  ማንን ነበር???	negative	amh
Terrible! ሰው አንዴት በሁሉም ነገር ከእዉቀት ነፃ ይሆናል!	negative	amh
አንተ ቆሻሻ ስው	negative	amh
አሉታዊ አስተያየት የምትሰጡ ሰወችን፣ ስማችሁ ብቻ አጋልጧችኋል! በመንጋ ብዛት በሚለካው ቦለቲካችን፣ አንድ ጠንካራ ሰው ሙስሊም ካልሆነ - ፀረ ሙሊም፤ ወረሞ…	negative	amh
ኢ/ ኣፍሪቃ ኣትበሉ ኤርትራ የሉም በሆዳሚች ሀገር ብቻ ነው እየታየ ያለው	negative	amh
**ትንግርት** ሚኒስቴር ጭራሽ Cost sharing ይቅር አለ ነው የምትሉኝ? ከምር ይሄ አቃጣሪ መንግስት በድሃ ነፍስ መጫወቱን ቀጥሏል።	negative	amh
Playboi Carti on Magnolia: በኒው ዮርክ ውስጥ እኔ ወፍጮ ዐለት መደበቅ ነው በ የእኔ ሶክ መሮጥ ከ ተቃዋሚ ከዚያ መተኮስ በ ተቃዋሚ	negative	amh
እንደውም ትክክለኛ ማስታወቂያ ሁሉ አይመስልም። ስህተት አይደለም እያልኩ እየተከራከርኩላቸው አይደለም እኮ- የዛኛውን ቅዠት እያወራሁ እንጂ :-)	negative	amh
የቴፒ ከተማ ሰላምና ፀጥታ ስጋት	negative	amh
ህግ እና ስርአትን የሚያስከብር መንግስት አለ ብለው ደህንነታችን ይጠበቃል ብለው አምነው ለትምህርት ከቤታቸው የወጡ ተማሪዎች ለምን ታገቱ? ይህን ያህል ጊዜ መንግስት የት ነበር?…	negative	amh
ኖ በኬንያውያን ላይ ነው ያለው	negative	amh
እምዬ ኢትዮጵያ ጉድሽን አላየሽ ክትክታ የማያውቅ ትውልድ አለልሽ.....????????	negative	amh
ጎጃሜዎች እንዲህ የሚል ስድብ አላቸው   እንጭቅ!  ምን ማለት እንደሆነ ግን አላውቅም	negative	amh
የሆነ ነገር መጥፎ ነገር ተናግሬያለሁ?!	neutral	amh
ልዩ የተፈጥሮ ገፅታ   *****  የምስራቅ አፍሪካ የውሃ ማማ ጮቄ	neutral	amh
ብ/ጄ አሳምነው ጽጌ ከምክትል ጠ/ሚ ደመቀ ጋር በሱዳን ጉብኝት አልበሽር ያሉትን ለተመስገን እንደነገረው....  ኢትዮጵያ ለእኛ ጥሩ ጎረቤታችን ናት፤ ከህወሓት ጋር ግን ቤተሰብ ነን።	neutral	amh
?? እሺ ወንድሜ እተከላለሁ ማኛ እኮ ናት ወዳታለሁ በጣም ደሞ  ቅና አሉህ ??	neutral	amh
ይቺን አውቆ ነው ዶ/ር አብይ ክርስቲያን የሆነዋ.......ኧረ ጀንፈሉ ይህ እንጣጥ እንጣጥ ዋዋዋ!	neutral	amh
1፣2012  የህወሃት ንብረት አካፍሉኝ ጥያቄ እና ኢህአዴግ ግንባሩ ንብረት ማፍራት የሚፈቅድ ህጋዊ አውድ ነበረ ወይ?የትኛውንስ ሀብትና ንብረት ነው አካፍሉኝ የሚለው? 1/3  ትዕግስት ዘሪሁን…	neutral	amh
ሰው የፈለገውን የመሆን መብት ቢኖረውም መብቱ የሚወሰነው ግን በሚኖርበት ሀገር ውስጥ ህጉ ማኖር ሲችል ብቻ ነው። ይህ ከመብት እና ከእኩልነት ጋር አይገናኝም፣ ከህግ ጋር እንጂ	neutral	amh
Global citizenንነቴ እና ኢትዮጵያዊነቴ ተምታተውብኝ አያውቁም የሚል ይታከልበት ??	neutral	amh
ለቅዳሚታችሁ  ????❤          አሁን በምትሰሩት ማንኛውም ነገር ምሉእነትና እርካታ ይሰማችሁ!  የአሁንነት ሀይል -ለመንፈሳዊ የእውቀት ብርሃን መመሪያ በኤክሀርት ቶሌየተዘጋጀ መጽ…	neutral	amh
ስንታየሁም ሆነ ኤልያስ ፓርላማ ለመግባት ምን ያንሳቸዋል??? ደግሞ ሁለት ሰው ብቻ ይዞ ፓርቲ ይመሰረታል ያለህ ማነው? መቸም በእስክንድር ላይ በየምክኒያቱ ዱላ የማ…	neutral	amh
አሜሪካ ሱሌይማኒን በመግደል ቀይ መስመሩን ሳታልፍ አይቀርም። ዜጎቿ አገሪቱን ለቀው እንዲወጡ አዝዛለች። ጀለሶቿ ደግሞ restrain እና de-escalate እያሉ መለማመጥ ጀምረዋል።	neutral	amh
ትንሽ ቆይተህ ዶ/ርብርሀኑና በዶ/ር አብይ መካከል ምንም ልዩነት የለም እንዳትለን ነው ምፈራው	neutral	amh
መንግስት ሆይ ሀገሪቷን የማፍያ መፈንጫ እንድትሆን አትተዋት - ሰላም አልፈልግም ብሎ ጉልበት ለመረጠ በእቅፍ አበባ ሳይሆን በሚደቁስ ጠንካራ ክንድ መቀበሉ የግድ ነው።	neutral	amh
ታቦተ ሕጉ ለእግዚአብሔር በካህናታ ሕጽርት ወበመንፈስቅዱስ ክልልት ንጉሥኪ ጽዮን ኢይትመዋዕ ለፀር ወኢየኃድጋ ለሀገር። በካህናት የተከበብሽ በመንፈስ ቅዱስ የተከለልሽ የእግዚአብሔር ታ…	neutral	amh
... እናማ ልሙጡ ባንዴራን ለቤተክርስትያኒቷ አስረክባቹ፣ secular በመሆን በተሻለ መንገደ ሰለማዊና የተረጋጋ ክልል በመፍጠር ሰርታቹ አሳዩን ና ተዛ…	neutral	amh
ሳያችሁ ግን ሶስተኛው የአለም ጦርነት ጉዳይን ከመጤፍም አልቆጠራችሁትም።	neutral	amh
ብድር በምድር መሆኑ ከሆነ ተገቢ አይደለም ከዚህ በፊት ስንቃወም የነበረው ይህንንም አልነበር ታድያ ጉልቻ ቢቀየር ሆኗል ነገሩ ማለት ነዋ ..…	neutral	amh
ለውጡን ያለመው የኦሮሚያ ባለሃብቶች ውይይት	neutral	amh
በኋላ ፣ በደቡባዊ ሥርወ መንግሥት ያያትጋሱ የተባለ ሠራዊት አለ ፡፡  ምናልባት ኢሉሚናቲ ሴራ ሊሆን ይችላል ፡፡	neutral	amh
በጣም ስውር ህዝብም ጭምር:: እኔ የሰዉ ሂሉን እሺ ብሎ መቻል በጣም ነው ሚገርመኝ::	neutral	amh
ሪፖርት | ፈረሰኞቹ ምዓም አናብስትን በመርታት ወደ አሸናፊነት ተመልሰዋል	neutral	amh
አይ ካሳዬ ስምንተኛ ክፍልን ዘልቋል ብለን ነው የሾምነው ???? መልሱ እኮ እዛው በቀይ ያሰመርከው ላይ አለ ... ከጊዜው ነባራዊ ሁኔታ ጋ ሊያራምዳቸው .... አለቀ።	neutral	amh
ልጅ ጠ/ሚ/ር ዶር አብይ አህመድ በጉጂ አባገዳ ተመርቀዉ ካላቻ አስረዋል። ዶር  እንኳን ደስ አለህ።	neutral	amh
... የገዛ ጓደኞቻቸውን ከመግደል ወደኋላ የማይሉበት ስሜት ላይ ነው ያሉት። ይሄ ደሞ በየትኛውም የተማሪዎች ዘመን ታይቶ የማይታወቅ ግልብነት/ግልፍተኝነት ነው።…	neutral	amh
የሰኔ 16ቱን ፍንዳታ በተመለከተ ወደአሜሪካ(FBI) የተላከውን የተጠርጣሪዎች አሻራ ውጤት ጤና ጥበቃ ሚንስቴር በነካ እጁ ቢገልፅልን።...ግራ ቢገባኝ እኮ ነው ??	neutral	amh
በኤክሳይዝ ታክስ ሰበብ የታየው የዋጋ ንረት መነሻው የተዛባ የገበያ ሥርዓት ነው ሲል መንግሥት አስተባበለ	neutral	amh
ልክ ጋን ዉስጥ እንዳለች እንቁራሪት ነዉ በለኝ ትንሽዬ ብርሀን ስታይ ኖራ ከጋኑ ስትወጣ በቃ አልተቻለችም እን…	neutral	amh
ሰዓቱ በእኛ ላይ ነው ፣ ሶሳውን ስጠኝ ፡፡  ተጣባቂ ሩዝ አምጡልኝ ፡፡	neutral	amh
ሰለቸኝ ጌታን ሰው ወደ አውሬነት እየተለወጠ ነው ደከመኝ ደከመኝ ጌታ ሆይ አረ ምን አይነት ዘመን ነው ሰው ፔጅ ላይ ሄዶ ያንን ሰው ሙሉጭ አርጎ መስደብ ምን ይሉታል መሳደብ ይቀላል ወይስ ያንን ፔጅ አለማየት?	neutral	amh
ልክ ነህ! ከምትላቸው ቃላት ያንተ ቅንነት ለመገመት ችያለሁ፡፡  ቅንማ ባትሆን ኪራይ ሰብሳቢነኝ ስትል፣ በኢትቪ ነበር ቀርፀው፣ ዶክሞንተሪ የሚሰርቡህ፡፡	neutral	amh
ተፎካካሪ ፓርቲዎች ተሰባስበው እና አንድ ቡድን አዋቅረው ፋና ፥ ዋልታ እና ኢቲቪ አጠቃላይ የህዝብ ሀብት የሆኑ ሚዲያዎች የባለቤትነት እና አጠቃቀም ላይ ጥርት እና ፅድት ያለ መስመር…	neutral	amh
እየሱስ ክርስቶስ ከድንግል ማርያም የተወለደ  ወይም በስጋ ከዳዊት ዘር  የተወለደው ስለሰው ልጆች ኀጢአት እዳለመክፈል ነው የምትሉ በዚህ ፔድ መወያየት እንችላለን	neutral	amh
የጌታዬ እናት፦ ንፂህተ ንፁሀን፤ ቅድስተ ቅዱሳን ድንግል ማርያም ምንም አኔ ሀጢያተኛ ልጅሽ መሆን የማይገባኝን አስቢኝ ።ከሰራሁት ይልቅ የልጅሽ ቃልኪዳን ይበልጣልና አሳስቢልኝ ። ሰዐ…	neutral	amh
እኔ tetemን ነው የሰማሁት መገመት ነው የት እንደነበርኩ	neutral	amh
ምን ማለት ነው? ኦሮምኛ እስክንለምድ ድረስ ኦሮሚኛ የምትችሉ ተርጉሙልን እስቲ  ፎቶው አንደኛ ነው! ፓ! ሰላም ፍቅር ደስታ ፈገግታ በሁሉም ላይ ሰፍኗል። ከነሱ…	neutral	amh
ሃሃሃሃ ቀልጅ ከአንድ ዓመት በኃላ መሬት በሚሊዮኖች ሆኖ የመገበያያው unit ዶላር ሲሆን ቡልልልልል ማለታችን እንደማይቀር እወቂ ????	neutral	amh
ነበር እድሜ ላንተ	neutral	amh
አሉ ከፋ እና ቦረና፤ ሰላም አይደሉም ወይ እነራስ ጎበና?!  የሚሰጡት ቢያጡ ከድፍን አበሻ፤ ለኡራኤል ሰጡት የጎበናን ጋሻ።  ተብሎ የተዘፈነላቸው ስመጥሩ ጀግና ራስ ጎበና ይህን ይ…	neutral	amh
በተለይ ምዕራብ ወለጋ ግዛቱ ሆነ። ሁለት ዓመት (ድፍን ሁለት ዓመታት) ሙሉ ኦነግ ነጻ መንግሥት ኾኖ ልጆችን ለወታደርነት ሲመለምል፣ ትምህርት ቤቶችን ጭምር የወታ…	neutral	amh
እረ እረፍት አርግ ይሄ ደግሞ የአንተ ስራ አይደለም	neutral	amh
የህዳሴ ግድብ የሶስትዮሽ ውይይት በካይሮ እየተካሄደ ነው	neutral	amh
ባየሽው ፡ የኔን ፡ መቼ ፡ ቀሎኛል፣ በታመምሽው ፡ ልክ ፡ እኔም ፡ አሞኛል፡፡	neutral	amh
በግሌ ዑስታዝ አቡበክር አህመድ የት ሆኖ ለ ም/ጠ ሚኒስትሩ ስልክ እንደደወለላቸው ጭምር ትዝ ይለኛል።	neutral	amh
እማማ ዘርፌማ ጂም ከርመው ነው የመጡት። የስኳቲንግ ምናምኑ ውጤት ????	neutral	amh
ይሄ ዜና ነው? ስብሰባው ከመደረጉ  በፊት ማለት ትችሉ ነበር!	neutral	amh
በአማራ ክልል አሁን ሊሰሩ ነው የሚባሉት መንገዶች ከ2008 ጀምሮ ሲንጠባጠቡ እና ሲራዘሙ የቆዩ እንጂ ፍትሀዊነትን ለማስፈን እስካሁን በአማራ ክልል ምንም አይነት የመንገድ ፕሮጀክት…	neutral	amh
እኔም እሱን ብዬ ነው	neutral	amh
የጎንደር ዩኒቨርሲቲ እንደሚለው ቅጣት የተጣለባቸው ግለሰቦች ኹከት እንዲስፋፋ ተማሪዎች ክፍል እንዳይገቡ መከልከል፤ ትምህርት እንዳይጀመር ተማሪዎችን፣ መምህራንን በማስፈራራት፣ ስለት…	neutral	amh
ኢትዮጵያን በሰላም እና በወጣቶች ስራ አጥነት ምክንያት እጦት እየተሰቃየች መሪ ነኝ ባይ ግን  ልማት ከማምጣት ይልቅ መዝናናት እና ድግስ በማድረግ የህዝብ በጀት…	neutral	amh
የወለጋ ጉዳይ “አለባብሰው ቢያራሱ...” ዓይነት ነው። “በመንግሥት” እና በኦነግ መካከል የተረገው ድርድር ግልጽ አልነበረም። ሁለቱ አካላት መስማማት አልቻሉም።…	neutral	amh
እንተዋወቃለን ወይ የሐበሻ ወንዶች ሐበሻ ሴቶችን ምን ያህል ያዉቃሉ  ??	neutral	amh
Ethiopia : አሁን ላይ ከዳር ቆመን የምናይበት ጊዜ አይደለም ፡፡ከዳር ቆሞ ማየት መብትን አሳልፎ መስጠት ነው ፡፡ የኢዜማ መሪ  ብርሃኑ ነጋ (ፕሮፌሰር) ዛሬ እሁድ በነጋ ቦን…	neutral	amh
ከበቂ መረጃ በላይ አለ ነገር ግን ለእንዳንተ አይነቱ ሰው አብይ እራሱ ወጥቶእኔ ነኝ የገደልኩት ቢል ከማጨብጨብ ውጪ ምንም አታደርግም ወይም ምክንያት እየፈጠርክ የሱን…	neutral	amh
የአዋሽ ባንክ የባለአክሲዮኖች 24ኛ መደበኛና 16ኛ ድንገተኛ ጠቅላላ ጉባዔ ላይ ወሳኝ የሚባሉ ውሳኔዎቸ ተላልፏል:: በዚህ መሰረት: --የባንኩ ካፒታል ከ6 ቢሊዮን ብር ወደ 12 ቢሊ…	neutral	amh
ብልፅግና ወደ ብልግና?	neutral	amh
ሽሮ ፍትፍት ????      ለሚያስፈልገው ሁሉ????	neutral	amh
አቡነ_መርቆሪዎስ ከ28 አመት በኋላ ለመጀመሪያ ጊዜ ተናገሩ ።   ለሃያ ስምንት አመታት  አንዳችም ቃል ከአፋቸው ሳይወጣ የቆዩት አቡነ መርቆሪዎስ የገናን በአል ምክንያት በማድረግ…	neutral	amh
እንዲህም ማለት ይቻላል:             ጔደኛየ አብርሃም ቢያይህ  አንተን ተጨቁነህ ያልነበርከውን ጨቌኘህ ለካስ ጭቁን ነበርኩ ብለህ እንድታስብ ያደረገህ መሆኑን ያብራራልህ ነበር!!	neutral	amh
እኛ ሁሉንም ነገር ሰበብ እናደርጋለን ፤ ጎረቤቶች ውስጥ ፣ ምንም; ውድ ሆነን ለመሸጥ እና ርካሽ ለመግዛት እንፈልጋለን ፡፡ ሳን ፍራንሲስኮ ዴ ሽያጭ	neutral	amh
ኣይይይ: መሬት ያለው ሰው ኣለ ይላሉ ኣማራ:: ኣዲስ-ኣበባ ያለ መንግሥት ከኣሥመራ ትእዛዝ እንደሚቀበል እስቲ ንገሩት ለዚህ ሰውየ:: ለክፋት ከሆነ እማ: ሻዕብያ…	neutral	amh
????የምር ግን መጽሀፍ ቅዱሱን እንክዋን ብዙ ቤተሰቦች የኔን አያት ጨምሮ እንደ አስፈሪና ሚባላ ነገር ስለውብን ተራ ሰው አያነበው…	neutral	amh
እሱንስ ይበሉ እሺ ግን ቤታቸው ውስጥ ገብተው ደምእንባ ሚያስለቅሱት ነገር ?? ሰው መርዳት ካለብን ዲግኒቲያቸውን መጠበቅ። ስንሰጥ ከመለፍለፍ መቆጠብ፣ በሚስኪኖች mise…	neutral	amh
እንኳን እነሱ: ትግሬዎች መላላክ እንደጀመሩ አልሰማህም እንዴ? ???????? ሚንስትር ዴኤታው: ጎበዛይ ምን አለ? የ…	neutral	amh
እንደዚህ ሰው ትራምፕን ጥብጥቢ የተጫወተበት የለም	neutral	amh
የወላይታ ሊቃውንት እና አክቲቪስት ነን ባዮች ከህወሓት ጋር የሚያደርጉትን ግኑኝነት ባልደግፈውም አልቃወምም። ምክኒያቱም ዋስትና ፍለጋ ሰው ሴጣን ጋር ሌሄድ ይችላልና።	neutral	amh
ቤሄሩን ስደግፍ ሌላዉን ጥሎ አይደለም  ሁሉን ባንድ ማየት ከቻለ ብቻ ነዉ	neutral	amh
“ጉራጌን ስትፍቀው ብትውል ጠንካራና ታታሪ ኢትዮጵያዊ ነው የሚወጣው”  ????❤️	neutral	amh
ነጻ ለመሆን መጀመርያ የነጻነት ትርጉምን መረዳት ወሳኝ ነው	neutral	amh
ቆይ ወንዶች ለበዓል ምንድነው የሚለብሱት? አቦ አስቀናችሁኝ... እኔም ሀበሻ ቀሚስ ልግዛ እንዴ?	neutral	amh
በኤርትራ ጉዳይ በጠበጣችሁኝ ብሎ እንደቀልድ ለ3 ወር ዩኒቨርስቲ የዘጋ መንግስት / አልጋወራሹ  ተማሪ አንድ አንድ እያለ እስኪጫረስ ነውንዴ የሚጠብቀው? ትምህርቱ ከደበራቸው እነሱም ይረፉ እስቲ	neutral	amh
ይቅርታ መቀሌ ያለክ መስሎኝ ነው??	neutral	amh
መረጃ ለመንጋው የመጀመሪያውን የሻሪያ ፍርድ ቤት በአዋጅ ያቋቋሙት ቀዳማዊ ኃይለ ሥላሴ ናቸው መረጃውን ጉልጉሎ ያወጣል አቻም ነው.	neutral	amh
