tweet	label	language
ሰኞ Thread  1.ጉዳዮቻችንን፣ የተረጋጋ ሀገር ሰላምና ብልጽግና ከማምጣት እንጂ ከአይዲዮሎጂ አንጻር እንደማይመለከት  2.አጀንዳዎቹን በድርድርና ሲወርድ እንደ ህዝቡ አውድ የማስፈጸ…	neutral	amh
የህገመንግሥቱን መግቢያ በመለጠፍ ውለታ ማን ይዋልልን? መቸም ውሸት ከሆነ ብዙ ሰው አያገኘውም ብሎ መሆን አለበት??	neutral	amh
ጊዜ ለሚካሄደው የ2012 ዓ.ም ሀገራዊ ምርጫ 50ሺ የምርጫ ጣቢያዎችን፣ እስከ 300 ሺ የምርጫ አስፈጻሚዎች እና 50 ሚሊዮን መራጮች ሊኖሩ እንደሚችሉ ታሳቢ ያደረገ ዝግጅት በ…	neutral	amh
በአንተ ቤት አራዳ መሆንህ ነዉ! አትዋሽ ማንም የሚልህ የለም እነሱ መቼ ሰዉ አጥተዉ ነዉ አንተን የሚጠይቁት?ለዛዉም እንደማትወዳቸዉ እያወቁ አይጠይቁህም።	neutral	amh
እንደ ሀኪም አንገት ላይ ጣል ማድረጉ?!	neutral	amh
በሶሻል ሚዲይ ተለኩሶ ወደ ከፍተኛ ህዝባዊ ሰላማዊ ሰልፍ የደረሰው የታግቱት ተማሪዎቻችን ይፈቱ ዘመቻ ካገር ወስጥና በወጪም በአለም አቀፍ ደረጃ በታወቁ ሚዲያዎች ጭምር ሽፋን አይተሰጠ…	neutral	amh
ሃሳብ! ቤተሰቦቻቸው ወደሚዲያ እስኪቀርቡ ድረስ ግን በተመሳሳይ ሃሽታግ ካምፔይን ማድረጉ ጥሩ ይመስለኛል፡፡	neutral	amh
መልካሙ ተበጀ <<ያን ጎራ>>  ??ያን ጎራ ያን ሰፈር በየት ልክሰሰው በየት አግኝቼ በየት ልውቀሰው ደብቆብኛል ያችን ኩሩ ሰው።፣??	neutral	amh
Sleep vs nap ?? ቀኑን ሙሉ ከተኛህም መች ይቀራል	neutral	amh
በጊዜው ከፍ እንዲያደርጋችሁ ከኃይለኛው ከእግዚአብሔር እጅ በታች ራሳችሁን አዋርዱ። እርሱ ስለ እናንተ ያስባልና የሚያስጨንቃችሁን ሁሉ በእርሱ ላይ ጣሉት ፡፡ 1 ኛ ጴጥሮስ 5.6-7	neutral	amh
ሌላ አለው እንዴ?	neutral	amh
ተሥፋ =ሠሙ ጥሩ ነው።  ሥጋት=ችኮላውና ወርቁ ዉስጥ የተደበቀው ሚስጥር ምን ይሆን? የህዋሃት ፍቺ! ያልታቀፉ ድርጅቶች? ትኩረት ያተሰጠው/ተንጠልጥሎ ያለው የደቡብ ብሄር ብሄረሰቦች…	neutral	amh
በፈረንጆቹ ገና እና አዲስ አመት ቀድመን አቅምና ገንዘባችንን ጨርሰን የኛ ድንቅ የሆነው ገና ገና ሳይደርስ እንቅልፍ እንቅልፍ አለን::በቃ ምን ይደረጋል ገና እና ጥይትን ተኝቶ ማሳለ…	neutral	amh
አህመዲን ጀበል ስለ ሞጣ ሲያላዝን ውሎ የሚያድረው በቃጠሎው አዝኖ ሳይሆን እራሱ ያቀነባበረው ስለሆነ ከዚያ ለማምለጥ ነው ከሞጣ ከተማ ሙስሊም እና ክርስቲያን የበለጠ  በጉዳዩ ያዘነ…	neutral	amh
የኢትዮጵያ ፕሪምየር ሊግ 6ኛ ሳምንት መርሐ ግብር	neutral	amh
ታህሳስ 22	neutral	amh
ነው። የትኛውን እውነት ብለን እንቀበል?!	neutral	amh
የማንችስተር  መቀጥቀጥ  ይሁን  ያርሴናል ማሸንፍ እንጃ፤  ድርብ  ድርብርብ  የሚሉት ነገር ነው መሰል ????	neutral	amh
ወግ ወጉስ ተይዟል፥ ችጋር አንቆ ይዟል አለች አያቴ ??????	neutral	amh
ይሄ ልጅ አዳማዬን ዋንጫ አስበልቶ ኮሌታዬን አቁሜ ጃኬቴን እያውለበለብኩ ፣ እያፏጨው የምቦርቅበት ቀን ነው የናፈቀኝ	neutral	amh
Sorry ኣባ መልእክቱ ለኣቶ ተስፍዩ  ስለሆነ ነው ::	neutral	amh
ለምን ተስፋ እንቆርጣለን ለምንስ እንዋረዳለን ከኛ እሚጠበቀው መጣር መስራት ስህተትን ቶሎ ማረም አለቀ	neutral	amh
ይሄን ሲሰማ አዝማሪው ምን አለ?    ናፍቆቴ ናፍቆቴ አይልም ወይ ሰዉ፤    ጉርሻ እየናፈቀዉ ፣ ሆድ እየባሰ…	neutral	amh
የእውነት ግን ማንቼን ማሽነፍ ትልቅ ነገር እንዳይመስልሽ ቃል። ስብስባችሁ የmidtable ቡድን ራሱ አይደለም??	neutral	amh
ዛሬ የቀድሞው ኢህአዴግ መጋዘን ሲፈተሽ የተገኘው ቀሪ የህወሃት ንብረት፡፡	neutral	amh
ሕዝቅያስ  ቢጠይቅ አምርሮ                     የባከነ ሰአት በነብዩ በኩል                ጌታ ጨመረለት ስላልተለወጠ                አባካ…	neutral	amh
በዉሃ ውስጥ የሚኖር የዉሃ እናት  የሚመስል ፍጥረት	neutral	amh
በመላው አለም ፕሮፌሰርነት ማዕረግ የሚሰጠው በወጣትነት ዘመን ሲሆን እኛ አገር ደግሞ ምሁሩ ጡረታ ሊወጣ ትንሺ አመት ሲቀረው ነው። ትምህርት ሚኒስቴርን የሚመሩት ሰዎች ፀረ እውቀት ስ…	neutral	amh
በጣም ከባድ ህመም ነው ተንናእለ እርሱ ሁሉን ነገር ነበር ውነ ንማ ስትጡሰየ ያፍክ ዝያመለ ንልቭፔ ርተክዶ	neutral	amh
አህመዲን ጀበል የሚባሉትን ግለሰብ አቻምየለህ ታምሩ እርቃናቸውን ነው ያስቀራቸው! ውሸት ሁለተኛ እንደማይደግሙ ተስፋ እናረጋለን! ይሄው ነው::	neutral	amh
የኢኮኖሚ ኃይላቸውን ለሚገነቡ ልሂቃን ምቹ ሁኔታን ይፈጥራል። አብዛኛውን ድሃና ምስኪን ለድህነቱ ምክንያት የሆነው የሌላ ብሄር ቋንቋና ኃይማኖት ተከታይ የርሱ ቢጤ ድሃና ምስኪን እንደ…	neutral	amh
ይቅርታን የምትለምኑበት እና ህመም እና ተስፋ መቁረጥ እንጂ ሌላ ምንም ያልተተዉበት ቀን የሚመጣው ክፉ ይመጣል እናም ሕይወትዎን በመጨረሻ በቀስታ እና በአሳዛኝ ሁኔታ የሰው…	neutral	amh
ከፍተኛ ሊግ | አዲስ አበባ ከተማ እና መከላከያ አቻ ተለያይተዋል	neutral	amh
ምስኪን ናት በተለይ እቺ ሳሙኝ ሳሙኝ ትላለች።	neutral	amh
! ሚዛን መጠበቅ በምድርም በሰማይም ይሁን የሚደነቅ ነው!!!	neutral	amh
በኢትዮጵያ የሃገር መከላከያ ሚንስትር ለማ መገርሳ የተመራ ከፍተኛ የልዑካን ቡድን የኢትዮጵያ እና የአሜሪካንን የሁለትዮሽ የመከላከያ ትብብር ለማጠናከር ዛሬ ጠዋት ዋሽንግተን ዲ.ሲ.…	neutral	amh
በሐይማኖት አሸናፊ የሚለው የዘጋቢው/ዋ ስም ግን ሌላ ትርጉም እየሰጠኝ ተችግሬያለሁ	neutral	amh
ኢዜማ	neutral	amh
በዚሁ ከቀጠልን በወረሃ ታህሳስ “መልካም እንቁጣጣሽ” የሚል text ይደርሰኛል ??	neutral	amh
የኦሮሞ ፌድራሊስት ኮንግረስ ሊቀ-መንበር መረራ ጉዲና እና የፓርቲው አዲስ አባል ጃዋር መሐመድ፤ የኦሮሚያ ብሔራዊ ፓርቲን በመመሥረት ላይ የሚገኙት ብርጋዴር ጄኔራል ከማል ገልቹ እና…	neutral	amh
ሲጀምር አሁን ባለው ሁኔታ ምርጫ የሚያሸንፈው ወይ ክላሽንኮቭ ወይ ብሄር ያለው ነው። ስለፖሊሲ ግድ የሚለው መራጭ እምብዛም…	neutral	amh
ሙስናውና የመልካም አስተዳዳር እጦቱ በእጅጉ እጨመረ ነው።	neutral	amh
እንደዛ ካልሆነ በስተቀር ሰውዬው ማንንም አይቦልኩም	neutral	amh
ስብሓት ቃል በቃል ብሏታል  ጃፓኑ ሰውዬ (?????? ያማሞቶ ) ነው የሾመው ብሎ	neutral	amh
የህግ ስዎችን እንዴት ማሸነፍ እንዳለበት የሚያውቀው እሱ ብቻ ነው!! ሲመጣ መደበቂያ ፈልጉ	neutral	amh
የሙስሊም ሴት ፎቶ ማድረግ አስፈለገ? ሃ ሃ ሃ ወዳጅ ለመምሰል ነው ወይስ ሙስሊሞችም አሉ ለማለት??	neutral	amh
ይፈራሉ?  እኔም አላጠቃህም። የምርምር ማስታወሻዎቹን እንደገና አነባለሁ።	neutral	amh
10ኛው ከፍለ ዘመን አገው አክሱም ገባ፣ ከዛ ብሁላ እስከ 12ኛው ከፍለ ዘምን ድርስ ሰፊ የህዝብ migration በማድረግ፣ ሁሉንም የአክሱም ማሃበርዊ ክፍል ተዋህዶ እዛው ቀረ። አሁ…	neutral	amh
ብቻየን አይደለሁም አንተም ማወቅህ ገርሞኛል:: አስቴር ዘፈን ላይ ብቻ ክትክታን የሚያውቅ ነፍ ነው	neutral	amh
አገር ምድሩ እንኳን ከትካች እንጂ ክትክታ አይደለም!	neutral	amh
አንተ ብቻ ነሽ	neutral	amh
Last one.  . .የአምናን ቀን አማሁት፣ ለአፌ ለከት የለው የዘንድሮው ባሰ፣ እጅ እግር የሌለው ...   ሥነቃል  ለኢ-ልቦለድ ፅሁፎች ሶፍት ስፓት አለን የምትሉ ብታነቡት ታተርፋላችሁ፤ የወዳጅ ምክራችን ነው። ??	neutral	amh
የውስጤ  ሀሳብ እሷ ታውቃለች!!  የቃላት ማነሱ ችግር የለውም ያለውን ይበቃ ነብር  ኤድቷን በትኖርልን ጥሩ ነበር እንጂ ያሬድዬ??	neutral	amh
ያኛው ኢህአዴግ ልማት እንዳይደናቀፍ ስንል የተውናቸው ሙሰኞች አሉ ይል ነበር ይሄኛው ኢህአዴግ ደግሞ ለአገር ደህንነት ሲባል ዝም ያልናቸው መአት ሙሰኞች አሉ እያለ ነው። አገር ደህና ነች ወይ???	neutral	amh
ከእንትን ፋብሪካ ሰራተኞች ጋር ከሚደረግ የበዓል ዝግጅት ወደ ጭልት ያለ የፖለቲካ እና ማህበራዊ ፍልስፍና ወደሚተነተንበት የበዓል ልዩ ዝግጅት ያደረግነው ሽግግር ሲጥም።	neutral	amh
thanks ሰሊናዬ?? ሰኞ አኞ ከሚለው ቃል የመጣ ነው የሚመስለኝ እና አያልቅም በዛ ላይ????	neutral	amh
ከተማ በሃይማኖት ተቋማት እና በንግድ ተቋማት ላይ በደረሰው ጥቃት እጃቸው አለበት ተብለው የተጠረጠሩ ወደ 80 ያህል ግለሰቦች በቁጥጥር ስር እንደዋሉ የአማራ ክልል ርዕሰ መስተዳድር…	neutral	amh
በዚህኛው ገና በሚዲያዎቻችን የታዘብኩት ነገር የሳንታ ክሎስ ፊቸሮች በየፕሮግራሙም ሆነ በየማስታወቂያው ተበራክተው መታየታቸውን ነው:: ይሄ ድንቁርናን መሰረት ያደረገ አካሄድ ነው:: በእንጭጩ መቀጨት ይኖርበታል::	neutral	amh
የበላይ አካል ማለት ግን ማንን ነው የሚወክለው? ስም የለውም? አድራሻ የለውም? የስልጣን ደረጃውስ አይታወቅም?  ግልፅ መሆን አለበት፡፡  We demand democracy!	neutral	amh
ይች ከኢራኑ ዘመቻ ለመሸሽ ያመጣሃት ምክኒያት ናት	neutral	amh
ጅቡቲን ሊያስገዛ በሚችል የገንዘብ መጠን Financial & HR system ገዝተው እዳ ህዝቡን እያሸከሙት ነው። ቀደም ሲል ያሸናፊውን ድርጅት ውድቅ ተደርጎ ማለቴ ነው።	neutral	amh
ሲሉህ እሰማለሁ...ብዙዎች ሲበሉህ አያለሁ...ከዛሬ በኋላ ስምህ fried bread ይሆናል..  ስምህ ማነው?  ጮርናቄ	neutral	amh
OFC እያደረገው ያለው ህዝባዊ ውይይት የሚያስደስት ነው ። እዚ ፊንፊኔ ያላቹ ነገ በሚሊንየም አዳራሽ  “Barii Finfinnee” በሚል ርዕስ በተዘጋጀው ህዝባዊ ውይይት ላይ እንገናኝ ።	neutral	amh
በ30 ሺህ 300 ካሬ ላይ የአድዋ ፓርክን እንዲሰራ የ4.6 ቢሊየን ብር ውል የወሰደው የቻይናው ጂያንግሱም ያለ ጨረታና ያለ ግልጽነት ያገኘው ውል ነው።	neutral	amh
ይህን አውሮፕላን በመገልበጥ ላይ ልናሆይ ዜጊ ምጅረ ምጣበ ትፊበ ያዚከ ናእ እነሱን ያቅርቡ. እደውልበታለሁ ልላችይ ንሆሊ ሚራገስአ ሱእ ትባልናም	neutral	amh
ፌክ አካውንት አለሽ ማለት ነው?	neutral	amh
እባክህ ምን እንደሚያስቅህ ትነግረኝ ቤተማርያም?	neutral	amh
ታድያ liberal ስንል፣ ለምሳሌ ምን ድነው ከ libertine የሚለየው እስቲ የሚአቅ ቃለ። እኔ ምፍረአው ቃሉን ደጋግመን ስንሰማው፣ እንለየዋለን ፣ ያደሞ ያወቅነው እዲመሰለን ይሆናል።	neutral	amh
አንድም ጊዜ በማላውቀው ቋንቋ SMS ገብቶልኝ አያውቅም ነበር! ብጥብጥ አደረገኝ ኧረ ምን ይሻላል? ቋንቋ ሳልማር...? የቴሌ ነገር ይገርማል!	neutral	amh
እኔ እየደነቀኝ ያለው ይሄ ሁሉ ህዝብ የኔን መሰደብ አስመልክቶ ላይክ የሚያደርገው ነገር ብቻ ነው	neutral	amh
Ethiopia በአርማጭሆ ሕጻናትን እና ሾፌሮችን በማገትና ገንዘብ በመጠየቅ ሠላም በማደፍረስ ሲንቀሳቀሱ የነበሩ ወደ 50 ግለሰቦች በቁጥጥር ስር ዋሉ	neutral	amh
ወሳኝ ኦሮሞ ናቸው፣ ምንም ጥያቄ የለውም።	neutral	amh
ምን ትላለህ፡ ሁሉም ታዋቂ ኣዳራሾች፡ መኖሪያ ቤቶች፡ ጽፈትቤቶች፡ ድልድዮች፡ ፎቆች፡ ቤተክርስትያኖችና ሃውልቶች በሙሉ በውጭ ኣገር ሰዎች ነው የተሰሩት። ስለዚህ የ…	neutral	amh
YEEEEEEEEeeeeeesssSSSSSSS!!!✊?? እናቴ ጫት መጋጥ ነው የምትለው?????? ከብትነት ምንም አይጠቅምህም ጎበዝ!!	neutral	amh
መርከብና አውሮፕላን  በሚሰርቁ ሰፈር ይህ ምስኪን መገኘቱ .....ያው ተስፋ አንቁረጥ ለማለት ነው!	neutral	amh
እሳት ውስጥ የገባ ጎማ ሆነ እኮ????????...	neutral	amh
የጅዋር ታሪክ እያበቃለት ነው በተለይ ከህውሃት ጋር የገባው ጋብቻ ግልጽ ሲወጣ እና የተቀላቀለው መድረክ ያባረረው ለት የኦሮሞ ሕዝብም የገንዘብ እና የእውቅና ጥማቱን የነቃበት ወቅት ላይ ነን።	neutral	amh
ዑስታዝ_አቡበከር_አህመድ እንዲህ ብሎ ነበር ➡  ካደረጉት ክፋት የበለጠ የሚያመው የንቀታቸው ብዛት የፈፀሙትን ጥፋት ራሳቸው ሙስሊሞች ናቸው የፈፀሙት ማለታቸው ነው   እውነት ነው ያማል! ??????	neutral	amh
አንች ልጅ... you are always speaking ma mind... ጭንቅላቱን(የእኔን) እያነበብሽ ፃፊ የተባልሽ እኮ ነው የምትመስይው... ምን ጉድ ነው! ለማንኛዉም Danke ብያለሁ	neutral	amh
እኔ ማን እንደሆን አላውቅም	neutral	amh
አንዳንዴ ይህ ነገር እኮ እንደው ሽንትም ሲመጣ ብድግ ይላል አሉ....?????♂️?????♂️???????????♂️?????♂️?????♂️?????♂️	neutral	amh
የባህል ምን? የባህል ምግብ? የባህል አልባሳት? የባህል መገልገያ ዕቃዎች?	neutral	amh
የመጀመሪያው ገዢ ነው የምሆነው! ??	neutral	amh
እና ምን ለማለት ነው?   ሆድ ልታባባ!	neutral	amh
ምን አልኩ???? ዝም	neutral	amh
እና ነገ ቅዳሜ ሊሆንልሽ ነዋ	neutral	amh
በቃ የገና ሳምንት የልደት ቀን ሲመጣ ብለን እንዘምራለን- ከዚያ it’s all up to you	neutral	amh
አቋም: ህወሀት አሀዳዊዉን ብልፅግናን አይቀላቀልም:: ለህብረብሄራዊ ፌደራሊቶቹ የፖለቲካ ካምፕ አንድ ግብአት ይመስለኛል::	neutral	amh
እስከ ህልፈታቸው ቀን ግንቦት 14/1980 ዓ/ም ድረስ የዝነኛው 102ኛው አየር ወለድ ክ/ጦር ዋና አዛዥ  በኤርትራ በረሃ በማዕሚዶ ጦርነት ላይ በመጨረሻዋ ደቂቃ እራሳቸውን ለሀገራቸ…	neutral	amh
መጨረሻም ወ Mal Fakaata?  ብሎ ሲጠይቅ ተማሪዎቹ እርስ በእርስ ተያዩና ወደ ሁዋላ ዞርው ሱሪያቸውን ዝቅ አድርገው አሳዩ!	neutral	amh
የ28 ቀበሌ ልጆችን እየጠራብሽ ነው ሚዩት ም	neutral	amh
ስድብ ብቻ ስለሆንክ እኔ ጨርሻለው፡፡ አንተ በደንብ ልኬን ምትነግረኝ ነገር ካለህ መቀጠል ትችላለ፡፡ ቻው	neutral	amh
በገና በዓል ገበያ የአቅርቦት ችግር   አለመኖሩን ሸማቾች ገለፁ-----ኢቲቪ መኖሩን ሸማቾች ገለፁ--------ዋልታ  ማንን እንመን? እኔ ግን ለዛሬ ዋልታን አምኛለው	neutral	amh
የጆሲ ሾው ግን የመዝናኛ ፕሮግራም ተብሎ መጠራት አለበት ወገን?	neutral	amh
ፌስቡኩ ሁላ ምርጫ ቅስቀሳ ሸተተሳ ይጀመር እንዴ?	neutral	amh
የፈጠራ ባለሙያዎች ማህበር ህጋዊ እውቅናን በማግኘት ተመስርቷል!  ማህበሩ ታህሳስ 12 በሲቪል ማህበራት ኤጄንሲ ተመዝግቦ በሀገር አቀፍ ደረጃ በፈጠራ ዘርፍ እንዲቀሳቀስ እውቅና ማግ…	neutral	amh
በጣም ምትደነቅ የአድስ አበባ ከተማ ከንትባ ነህ ኢንጂነር ታከለ በዝህ አሥደሣች በሆነዉ ሥራህ ይህ ሕዝብ ማገገልህን ቀጥል እኔ በራሴ በጣም አደቅሃለዉ የክብር ምሥጋናየ ይድሬስህ ደህና ሁንልን	neutral	amh
ዛሬ በድንምብ እንደታየው ኦሮሞ እንደዚ በኢትዮጵያ ንግሰነግስቶች ጋር ለረጀም ዜዜ ከሰራ፣ ለምን ድነው ኢቶጵጵያ ዛሬ በዘር የተከፋፈለችው።	neutral	amh
ቆይ ከፊት ምን አይቶ ነው አረግ	neutral	amh
“ጌታቸው አሰፋ የዜጎችን ኢ-ሰብአዊ አያያዝ ሲቃወም፤ የሚያደናቅፉት እነ ደመቀ ነበሩ። - አቶ አስመላሽ ወስላሴ  (የአይጥ ምስክር )	neutral	amh
እውነተኛ መሆኑን ነዋ?! እመብርሀንም ብትሆን የውሸት ዜናን ማጋራት የምትወደው አይመስለኝም ??	neutral	amh
??... አቅምን አውቆ መኖር ጥሩ ነው እናቴ::	neutral	amh
wow!! በዚሁ መሰረት የአማራ ሕዝብ ቁጥር 2 ወይም 3ሚልዮን ነዉ ማለት ነው.	neutral	amh
ህወሀት አባታዊ ትግስቷን እየተወጣች ትገኛለች። የህወሀት ትግስት አለማድነቅ አይቻልም  (ዲማ ነገዎ) (የሰሞኑ የአላማጣ ከተማ ሁኔታ የTPLF ትዕግስት ማሳያ ነው Tariku Solome Rebso)	neutral	amh
??????ሃሃ እኔም እንደዛው ጎንደር አርፈው ወደ ራስ ደጀን ሲሄዱ ትልቁ ሰይጣን ትልቅ ተራራ ስር ነው ብለን እናስብ ነበር???♂️ አይ ልጅነት እና ጅልነት	neutral	amh
እኔ ማን ነበርኩ የሚል ማንም አልነበረም ፅምድ ሽሳፍየ አንድ ቅርጽ በረዶ ውስጥ ይታያል ልያታይ ክልመ ፍሃሾማ	neutral	amh
እንኳን. ለጌታችን. ለመዳኒታችን. እየሱስ ክርስቶስ  የልደት.  ቀን  አደረሳችው	neutral	amh
ወጣቱን ደጋሚ ሊማግደው ነው ብር አምጡ ነጋ ክክክ ወጣቱ ከእስክንድር ጋር ነው	neutral	amh
Haha ከብቶ ለመረዳት በደንብ አባምጪ ወደድኩሽ ላለሽ ሁሉ መቼም በርሽን አትፍችም አደል? ምኔን ብለሽ መጠየቁን አደራ እንዳትረሽዉ	neutral	amh
የሰዎች አዘዋዋሪዎች በሱዳን መጋዘኖች ዘግተውባቸው የነበሩ 102 ሰዎች መመለሱን በኻርቱም የኢትዮጵያ ኤምባሲ አስታወቀ። ኢትዮጵያውያኑ ወደ መካከለኛው ምሥራቅ አገራት በሕገ-ወጥ የሰዎ…	neutral	amh
ማን ፊት ምን ማለት እንዳለብኝ በዝግ ከራሴጋ ስብሰባ እቀመጣለሁ ??	neutral	amh
ትናንት ያወጣችሁትን የአቋም መግለጫ በአማርኛ አላየነውም ነበር …….ለካ ከመግለጫው አንዱ ህወሃት ስሟን  ጀዋር ብላ መቀየሯ ነው፡፡ ??????ቀስ እያልሽ ሌላውንም ተርጎሚልን	neutral	amh
ለሪፐብሊኳም ዕውቅና ተነፈጋት? ወገኛ ቀበሮ ሙክት ታበራለች አሉ።	neutral	amh
እልህ ______ ያስውጣል? ለሚለው ጥያቄ ትክክለኛው ምላሽ፥ ሀ.ቢላ ለ.ዱላ ሐ.ምላስ መ. ፓርቲ??	neutral	amh
ሲሰራ ጀምሮ IG ላይ እየተከታተልኩ ነበር ፣ እድል ገጥሞኝ ባለፈው ሰሞን ነው ያየሁት	neutral	amh
Word ????  ፩) በላህ?  ፪) በቤትህ ሞቀህ?  በቃ የሰው ፍላጎት ቀላል ነበር ሲጀመርሳ  ምን ዝውርውር ቅብዥብዥ ወደ ቀልብ የሚቀልበን  እንዲህ እስከሚታጣ?	neutral	amh
ሸዋርቢት ደብረ ገነት ቅድስት ማርያም ቤተክርስቲያን! ⛪????❤	neutral	amh
በደረትዎ ላይ ያ ምንድን ነው? ይህን ያህል መጥፎ የሆነው ለምንድን ነው? በልብዎ ውስጥ ቀዳዳ በመቆፈር ሰይጣን ነው ፡፡ ሁሉም ሰው ይጠቁማል እና ይስቃል። አንጨነቅም ፡፡ ሃሃሃሃ	neutral	amh
እንደ ድመት ፕፍፍፍ የምትሉት ነገር አለ ደሞ!	neutral	amh
ወይ በድርድር?! በኣባ ገዳዎች በኣካባቢው ወጣቶች በዛ ብሚንቀሳቀሱ ፀጥታ ሃይሎች በተቀናጀ እንቅስቃሴ..?????♀️	neutral	amh
በጣም ነው ያዘንኩት ፥ ባንቺ መርፌ ለመሰካት ያልፈሩ ባልተማረው ላይ ምን እንደሚሰኩ ፈጣሪ ይወቅ :-)	neutral	amh
አቦ ተፋታን ራስህን ብቻ እንደ ብልጥ  አትይ ተነቅቶብሃል okay እዛዉ ቧ እያልክ ትቀራታለህ ጠብቅ	neutral	amh
ዳኒ ቦይ!  እስቲ የትግራይ ፍርድ ቤት ፕረዚደንት፥ ፖሊስ አዛዥ፡ እንዲሁም የትግራይ የሃይማኖት መሪዎች ለምን ከህወሃት አባልነት ነጻ እንዲሆኑ አልተደረገም…	neutral	amh
ውስጥ የሙስሊም ምግብ ቤት መብዛት; ማርካቶ ላይ የስልጤናጉራጌ ሱቆች መብዛት; ቤተ ክርስትያን ውስጥ በኦሮምኛ መቀደስ አክራሪነት ነው የሚል…	neutral	amh
ጋይስ ከክትክታ ወደ እስክስታ ከዚያ ወደ ችፍርግ የተቀየረው አርእስት መስመሩን ሳይስት ወደ ፍትወት ደርሷል ????	neutral	amh
የ2012 ዓ.ም ሀገራዊ ምርጫ ረቂቅ የጊዜ ሰሌዳን በተመለከተ ከባለድርሻ አካላት ጋር ውይይት እየተደረገበት ይገኛል።  የባለድርሻ አካላት አስተያየትና ግብአት ይሰጡበታል ተብሎ እንደሚ…	neutral	amh
ኡፋ ነው ኤጭ እያለች የዘፈነችው ዘፈን ሰዉ ሲቀባበለው ነበር	neutral	amh
;;በሠሞኑ የአማራ ክልል ሠለፍ የታየው ሥረአት ያለ የክልሉ ወጣት መፈጠሩን -እንኮን የአገር ሀብትና ህይወት እያጠፉ ሰልፍ ሊያደርጉ ፤  አበባ ሣይረግጡ ፣ቅጠል ሣይበጥሱ መልእክት የ…	neutral	amh
ስንቱ በዳሃ እንባ ስንቱ በዳሃ ደም ሰርክ እየታጠበ: ለፍርድ ይቅረብ ያልነው ለምርጫ ቀረበ::  በላይ በቀለ ወያ	neutral	amh
ኧረ በገላጋይ እናንተ ሰወች፣ እንዴ?!? ሽማግሌም አትፈሩ? በሉ፣ አንቺም ተይ አንተም ተው??	neutral	amh
መሪን በጥረቱ መመዘን ድንቅ ቸርነት ነው ለፖለቲካዊ መሪዎች አይሆንም እንጂ::	neutral	amh
2)የሠወች ሠም ከቀደምት ነዋሪወችንን እና ከሌላው የሠሚን ደጋማ ቦታ ጋር ያለው የሠወች የሥም አወጣጥ ጋር ቁርኝት በግልፅ የቦታውን ባለቤትነት ይናገራል በሠው ሥም አወጣጥ ከትግራይ…	neutral	amh
አሁን ስልጣን ላይ ያሉትን ያመጣቸው የህዝብ ብሶት እንደሆነ ዘንግተውታል ግድ የለም ተገፋ ከፍታህ ላይ ሊያወጡህ ስለሆነ በርታ እውነት ያሸንፋል።   ድል ለዴሞክራሲ	neutral	amh
አገሩን ይወዳል satelliteኧን ፕሮፋይል ፒክቸር እንዳረገ ሰው ግን ማንም አይሆንም???? ; አብረን እንተኮስ አላቹሳ	neutral	amh
አበባም ይሁን በየትኛውም የኢትዮጵያ ከተሞች የሚመረጠው መንግስት የሚተዳደረው ሕዝብ በከፈለው ግብር ከሆነ ሁሉም በዛ ቦታ ላይ ግብር የከፈለ ሰው በዛ መንግሥት ላይ ኃላፊነት [እና የ…	neutral	amh
የንብዮዮቹ ቃል በሬት ስር ባቡር እና በኮንዶሚየም ግድዳ ላይ ተጽፈዋል - ፓኡል ሳይሞን ፣ የጸጣ ድምጽ	neutral	amh
