tweet	label	language
Tesfaye ለካስ ጭብል ለብሰሽ የፕሮፌሰርን ፎቶ ለጥፈክ እልም ያልክ ባዳ ነክ እፈር ትንሽ	negative	amh
ይሄው ነው አይደል የእውቀትሽ ጥግ....በሰሚ ሰሚ ከምትናገሪ ለምን ታሪክ አታነቢም....ደሞ ራስሽን አታስገምቺ	negative	amh
ዘገበ ይባላል? ሌላ የሚባል ነገር ካለ አንተዉ ንገረን!	negative	amh
?? ድሮ በዘመነ ኮዳክ ፎቶ ቤት ፍላሹ ፏ ሲል አይናችን ተጨፍኖ እንዳይወጣ የምንቸክለውን ነገር አስታወሰኝ ???? ምን ሆኖ ነው ግን? ከሗላ ያለው ቴዲ ሁሉ ፊቱን አዞረ እኮ ??	negative	amh
ዠልጥ?? ???? ገገማ	negative	amh
ለመጥለቅ ያህል ወሳኝ ነገር ያስፈልጋል ልያታይ ጥስው ዶረበ ጽርቅ ድንአ ምንም ሳይነሱ ሉቃብጠይ ንዱንአ ንችታለሁከ ይአ	negative	amh
የነዚህን አይነት ወሬ አራጋቢ ነው!  Do you get me!!?	negative	amh
ያንተ የበታችነት ስሜት ነው፣ ማንም አክራሪ ሰክሮ እየመጣ መስጂድህን ሲያቃጥልብህ፣ እኛ ብንናገር አንተ መልሰህ እኛን ምን አገባቹ ትላለህ።ያንተን አይነት አለቅላ…	negative	amh
አብይ እራሡ ጀዋርን እንደ መጠቀሚያ አርጎታል ለዚህ ሁሉ ተጠያቂዉ አብይ ነዉ	negative	amh
። ጥንብ ዘረኛ ጥፋ ከዚህ መርዝ	negative	amh
Arte በገናው ምድር በዚህ ሲያስተክዘን አመሸ	negative	amh
ላይ !   የእነዛ 86 ምስኪን ንፁሃን ምንዱባን ነፍሳት የተቀጠፈ ህይወት አይረሳም !  በአንድ ቀን ጀምበር…	negative	amh
እኔ ሞቻለሁ ???????????????????????? ጌታ ሆይ ኧረ ና!	negative	amh
ያንች ነፃነት በአማራ ህዝብ ነው ወሬኛ	negative	amh
እወድሽ ነበረ ዛሬስ ጠላሁሽ  እንደ ሰፌድ ቆሎ ያም ያም ዘገነሽ፧ ወይ ጉድ	negative	amh
ታብሌት ኮምፒውተሮቹ በሥጦታ የተገኙ ናቸው ወይሥ በህዝቡ ገንዘብ የተገዙ?የከተማ አሥተዳደሩ በጀት ይዞለት ነበር?ወይሥ ወዘፈቀደ ከንቲባ?…	negative	amh
ከመወደዱ የተነሳ ዱለት በሲኒ ማስቀመጫ ከመቅረብ አልፎ በቆርኪ የሚቀርብበት ጊዜ ሩቅ አይደለም! ??	negative	amh
የ ሰው ህይወት ቀልድ ሆነ በቃ	negative	amh
ሴት ብሆን አይደለም ይሄን በሬ ወለደ ብልሽ ታምኚኝ ነበር...እድሌ ነው??	negative	amh
ምን እያልኳት ምን ትላለች አሉ .. የከተማው ሙታንታ ሳይታጠቅ ያደገ ፎሊስ በል ፎከቴያሙ ድይቆን ሁሉ አልቀሩ	negative	amh
የቆሸሸ ሟች ለመደበቅ እዚያ እንደቆሙ አውቃለሁ	negative	amh
አንዳንድ   ሰዎች  ኢንሻላህ ኢራን አሜሪካን  እንደምታሸንፍ  አስረግጠው  ሲበጠረቁ እያዬሁ ነው ።  - - ሐይማኖትና ጎሰኝነትኮ ሃቅን ለመድፈን ተወዳዳሪ  የላቸውም።	negative	amh
ደግ አደረገችህ ምን ብለህ አፍህን ከፍተህ ነው	negative	amh
መንግስት ስለ ዲሞክራሲ ሲቀደድልህ አትስማው። የሚያደርገውን ነገር በደንብ ተከታተል። ያኔ ዓላማው ይገለጥልሃል።  የሃሳብ ነፃነትን የሚከለክል መንግስት ስለ ብልፅግና ቢያወራህ እንኳን…	negative	amh
ካቀድነው በላይ ታጋች ያሥፈታን ቢሆንም ከእቅዳችን ጋ ይሠናሠል ዘንድ አንዳንዶቹን መልሠን ለአጋቾቹ ሠጥተናል! ወይዘሮ ንጉሡ ጥላሁን! ••• ! :D :D :D !	negative	amh
ጉዳዩ አገር ሰላም ብሎ የተቀመጠን ህዝብ ለበቀል እና የርስበርስ ጦርነት የሚቀሰቅስ ነው።	negative	amh
መጋኛ	negative	amh
አይባልም	negative	amh
ብልፅግና ፓርቲ አዲስ ፓርቲ እንጂ የኢሕአዴግ ውህድ አይደለም ኦቦ በቀለ ገርባ ለ ኦ ኤም ኤን የሰጡት አስተያየት	negative	amh
በ3ኛ አካል ይጣራል የንተ መደሰት እንድንጠራጠር አርጎናል	negative	amh
«ባሐሩን የምታደፈርስ መስሏት አሞራ አለማወቋ እና ለውንብዳናዋ ትልቅ ባህር ላይ ትሸናለች እንጂ የሷ ሽንት ትልቁን ባህር የማደፍረስ አቅም የለውም»  አቦ ለማ መገርሳ  በሰላም አሜሪካ ገብተዋል!	negative	amh
ቱ በሉ የመራራ ፓርቲ በከበቡሽ ካልተዋጠ!  የመራራ ፓርቲ እንደ ልጥ መዋጡ ነው። ያኔ ኧረ ጀዌ (ከበቡሽ) ፓርቲዬን ዋጠው ቢለን መስሚያዬ ...  ወይኔ መራራ ስሜ መራራ	negative	amh
አንተን እስከ ቤተሰቦችሁ ወደቃሌቲ ማረሚያ ቤት ያስገባህ????????	negative	amh
በጎች በሚዘረፉበት አገር? አንፎጋገር	negative	amh
አይ ሳሙኤል በቃ የምትበላውን መፖሰት አስተማርክብን ጠርገው የሚበሉት መጡ	negative	amh
ይህ ሁሉ ለማያውቁ ሰወች እስልምና ይመስላቸዋል በጭራሽ የለውም። ይህ ሰይጣናዊ ዛር አለያም እንደ አዩ ጭፋ አታላይ ነው።	negative	amh
አሁን ያሉትም ያው ናቸው ባክህ! ምን ተቀየረ፥ መሪው ያለውን አሜን እያለ የሚቀጥል ካድሬ ነው። መሪው ደግሞ ከእኔ በላይ አዋቂ የሚል ቱልቱላ ነው :)	negative	amh
ባክሽ ፒፕሉ ሲያሽቋልጥ ነው ባለፈውሳምንት ፍትህ ለቀይ ቀለም እሲኪያስብል ቀይ ለብሶ ህዝቤ ሶሻል ሚዲያውን አጨናነቀው  ደሞ አሁን ይሄ ምነው ሸዋ	negative	amh
ፍትህ በሌለበት ሀገር ደሞክራሲ አለ ማለት ህዝብን መዋሸት ነው፤ ኢትዮጵያ ውስጥ ከቀበሌ ሊቀመንበር እስከ ምንስቴር ያለው አመራር ቅናተኛና ቅመኛ ነው፤ ፍትህ ለስዳማ ምሁራን 5 ወር ሙሉ ያለጥፋታቸው ለታሰሩት !!!!!	negative	amh
አብይ ይህን ደንባራ ሙታንታ ሳይታጠቅ አዲሳባ ከዛም ቤተመንግስት የገባን ሽፍታ ዘር ዎንበዴ ጥይት ሳይተኩስ መቀሌ ሸኝቷል…	negative	amh
ከንቲባ ታከለ ዑማ በቢሮዎችና ማዘጋጃ ቤት ስር የሆኑ ተቋማትን ተጠሪነት ወደ ራሳቸው እያዞሩ ነው። የአለም ባንክና የከተማ ልማትና ቤቶች ሚኒስቴር ድርጊቱን ተቃውመዋል። Wazema…	negative	amh
በሊቢያ በጦር ማሰልጠኛ  ተቋም ላይ በደረሰ ጥቃት 30 ሰዎች ተገደሉ፡፡	negative	amh
ድርጅቱ ከተቋቋመው አላማ ውጪ እየተንቀሳቀሰ ነው የሚል ዜና እንዳንሰማ?? እንዴት እኝህ የምያክል ጉመት ፖለቲከኛና የኢትዮጵያዊያን ህዝብ ተወዳጅ ከነፍሰበላው ጃ-…	negative	amh
ዲኑ የቆየ ነው የምንሰማበት መልኩ እንዲህ መራራ መሆኑን ለማንሳት ነው	negative	amh
እንደሱማ ከሆነ እናንተም ቦታ ላይኖራችሁ ነው	negative	amh
ይልቅ ለሶስተኛው የአለም ጦርነት እራስሽን አዘጋጅ አልሰማሁም እንዳትይ	negative	amh
በዚ ዘመን ሰዉ ከገንክ ሚቆመዉ ለፎቶ ቢቻ ነዉ ቢገኝም  ከጎንክ ሚቆመዉም ከስንት አንዱ ነዉ	negative	amh
የግል ቢሆን ኖሮ ግን ተደራድረው በሚያዋጣቸው ዋጋ ይሸጡ ነበር። 6	negative	amh
በሙስሊሙ ጉዳይ የአብይ አህመድ አቋም በዚህ ከቀጠለ  ፣እመኑኝ ወያኔ የገባችበት ቅርቃር ውስጥ መግባቱ የማይቀር ነው።	negative	amh
መደመር የተንፈራጠጠ ሀሳብ ነው   ፕሮፌሰር መስፍን ወልደማርያም	negative	amh
እንዳንተ ያሉ በጋዜጠኛ ስም የሚሸረሙጡ ሴሌክቲቭ አታካቸውን ስንመለከት ለአገርና ሳይሆን ለጥቅም አሽከርነት የቆማቹ ህሊናቢስ እንደሆናቹ እንረዳለን:: እዚያዉ ካም…	negative	amh
ራስን የማግሰፍ ስልት ከልክ ስያልፍ ዉሸት መሆኑ ይታወቃል።እኔ ብቻ ነኝ የላቀ ሃሳብ ያለዉ ማለት በራሱ አምባገንነት ነዉ።የሚያገዳድልም የመንግስት ጀሌና ወ…	negative	amh
ባሳለፍነው አርብ በኦሮሚያ ክልል ቄለም ወለጋ ዞን ሰዮ ወረዳ ጉቴ ሰዮማ ቀበሌ በሚኖሩ የአማራ ተወላጆች ላይ ታጣቂዎች 4 ሰዎች መግደላቸውን ሸሽስተው ወደ ደንቢዶሎ ከተ…	negative	amh
እኔ አልላክም ነበር	negative	amh
በለው ! ታድያ  በኢትዮጵያ ሰላም ኣለ የተባለው  የት ኣለ?::	negative	amh
ስራችሁ ሁሉ ክፋት መስሪ  ምን አይነት ስይጣን ነው የተጠናዉታችሁ  የገዛ ወገናችሁን ለማጋደል ቀንና ሌት የምትባዝኑት? እኔ አብሬ ያደግኳቸው ትግራዬች ደግና…	negative	amh
ባህር ዳር ከተማ ወሳኙን ተጫዋች በጉዳት ሊያጣ ነው	negative	amh
ልክ ነው ሚሰማ ሰው አይደለም እኮ????????..	negative	amh
ክልል ላይ የእስልምና ጥላቻ እንደልብ እንዲጋልብ ባዶ ሜዳ ተለቆለታል። በባለሥልጣናትም ድጋፍ ይደረግለታል። ፍዳውን የሚከፍሉት ሙስሊም የአማራ ተወላጆች ናቸው። የገዛ ልጆቹን ቀርጥፎ የሚበላ ክ…	negative	amh
እናቶቻችን ጎረቤት ጉድ እስኪል ድረስ ይገርፉን እና ልክ ሲያበቁ ሁለተኛ ትደግሚያትና እንዳሁኑ ነካ አድርጌ የምለቅሽ መስሎሻል ??	negative	amh
አረ ምንሼ? የአዲስ አበባ ወጣት ጠላሁ! ወጣት ማለት ከ50 በላይ ሆነ እንዴ ሳናውቀው? ሚሊኒየም አዳራሽ ውስጥ ዛሬ የጎልማሶች ስብሰባ ነበር ቢባል ይቀላል!	negative	amh
አንተ ቆሻሻ	negative	amh
EBC ያልተገባ ተፅእኖ እያሳደረብን ነው...  የኢትዮጵያ ብሮድካስቲንግ ኮርፖሬሽን አስተዳደር በትግራኛ ቋንቋ ክፍል ላይ ያልተገባ ተጽእኖ እያሳደረ ነው ሲሉ የትግራኛ ክፍል ባልደረቦ…	negative	amh
እኔ አላምንም! ኧረ ቅሌት!	negative	amh
አቃቤ ህግ መጥሪያ የሰጣቸውን ተጠርጣሪዎች  አንዳንድ ክልሎች አሳልፈው አይሰጡም- አንዳንዶቹ ጭራሽ ይሾሟቸዋል! እንዲህ አይነት የክልልና የፌዴራል ግኑኝንት ባለበት አገር ውስጥ አገር ሳይሆን የሚያ…	negative	amh
ወገኛ ??ሲያደርጉ ታይቶልኛል እንዳንተ አይነቱን መርዝ አንደኛ ቦልኬ ክብር አልሰጠውም ልክ ስትቦልከኝ በደንብ እንዳስነቀልኩክ ማረጋገጫዬ ስለሆነ እስክትነቅል ለራስህ ግ…	negative	amh
በደራ ያሉ አማራዎች መሥርያ ወደላይ እየተኮሱ ከጋ** ጋር ጦርነት ነው ምንፈልገው እያለ እየሸለሉ እየፎከሮ  ኦሮሞውን መውጫ መግብያ እያሳጡት ነው   የኦሮሞ ህዝብ በሁሉም አቅጣጫ ጦርነት…	negative	amh
በግድ የበታችነት ስሜት ይስማህ ነው? Sorry	negative	amh
እውነት አታፍርም የሶስተኛ ክፍል ተማሬ ይሄን አቀደ አለመ አሳካ ስትል ????የእስፖንሰር ድርቅ	negative	amh
እንዲህ ያለን ነጭ ውሸት በቴሌቪዥን ቀርቦ ማውራት? ድፍረቱን ከየት አመጣው?	negative	amh
የሀገር ሽማግሌዎች በሕግ የበላይነት ካልታገዙ እነሱም የስርአተአልበኞች ተጠቂ ሲሀኑ እያየን ነው። አዛውንቶች የወጠጤዎች ጡጫና እርግጫ መለማመ…	negative	amh
ድብቅ በጣም ብዙ ድሃ በጣም ብዙ ድሃ በጣም ብዙ ድሃ በጣም ብዙ ጊዜ በጣም ብዙ ጊዜ በጣም ብዙ ጊዜ በጣም ደካማ  በጣም ብዙ በጣም ብዙ ጊዜ በጣም ብዙ ድሃ በጣም ብዙ ድሃ በጣም ብ…	negative	amh
አንተ ደግሞ ቶሎ የሚከፋህን ፀባይ እስካሁን አላሻሻልክም።	negative	amh
ስንቶቻችን ነን ባለፉት ሁለት ዓመታት ብቻ በመላ አገሪቱ 34 መስጊዶች መቃጠላቸውን የምናውቀው? ከ 34ቱ የተቃጠሉት መስጊዶች 21 የተቃጠሉት በአንድ ክልል (በአማራ ብሄራዊ ክልል) መሆናቸውንስ?	negative	amh
በመንገድ ላይ:-  አዲስ አበባ ቆሻሻ እና ጉንፋናም ከተማ መሆኗ አያከራክርም። ቆሻሻ መንገድ ዳር ለመጣል የሚሳቀቁ ስልጡን ነዋሪ ቢሆኑ እንኯን የቆሻሻ መጣያ በአቅራቢያው መቸም አያገኙ…	negative	amh
ማን ፈቀደ ህዝብ ተወያይቶበታል? በቢሊዮን የሚቆጠር መሬትና የህዝብ ገንዘብ እየዘረፍክ ለፎቶ ከህዝብ በተሰበሰበው ገንዘብ ማንም ሳይፈቅድልህ ለምርጫ ስትል የህዝብን…	negative	amh
ችግር የለውም እሱን እዚሁ ማስተካከል ይቻላል ፤ ብሄር የለንም የሚሉት የራሳቸውን ፓርቲ ይፍጠሩ	negative	amh
እሺ! ሥምህን እና PPህን ቀይራ! አሥራት ወልደየሥ የአማራ ጎጠኛ ነበር!	negative	amh
ሃሃሃሃ ዶማነትህ ከዚህ ነው የሚጀምረው እውነት የሚመስል ወሸት ያል…	negative	amh
ውይይይ ምንድነው እንደ አሮጊት ካፕል ምትነዛነዙት?? ወደዛ ዶናት ግዛላት አቦ?????♂️	negative	amh
ጭራቅ ከላይ እስከታች በአርቴፊሻል ብትሽሞኘሙኝም  እንደወረድሽ ነሽ?????? መጀመሪያ በራስሽ ኩሪ አፍሽን ከመክፈትሽ በፊት የሆንሽ ጨ ተገልብጣ ነገር	negative	amh
አዲሰ አበባ ሞጣ መሰለህ እንዴ??	negative	amh
ከክትክታ ወደ እስክስታ እንዴት እንደገባችሁ ገና አሁን እያነበብኩኝ ነው	negative	amh
???? ወዮ ይቺ ደግሞ የባሰባት ነው	negative	amh
ኢብራሂም ቢያይህ «አንተን የጨቆኑህ ‹አልተጨቆንኩም› ብለህ እስክታምን ድረስ ነው› ብሎ ይገረምብህ ነበር! ??   የመብት መገፈፍ ምን እንደሆነ ካለመረዳት የመነጨ ነው ች…	negative	amh
አይ ሸገር!  አይ አዱ ገነት ?? በአንድ ከተማ ላይ በታክሲ የ3 ብር መንገድ ልዩነት አንዱ የክርስትና ልጅ አንዱ የእንጀራ ልጅ የሚሆንበት! አንዱ ካዛ ላይ የከፈለበትን የስብሰባ አዳ…	negative	amh
የመጨረሻ እስትንፋሳ እስኪያደርጉ ድረስ ከፍተኛ ሥቃይ ይሰማዎታል ፣ የደምዎ መስመር ይሰቃያል እናም ከሞተ በኋላ ወደ ሲኦል ዋሻዎች ይገባል። ከሠራው ኃጢአት…	negative	amh
Hahaha.....ሟርተኛ አትሁን እንጂ አቶ ያሬድ?  ገናን ሳላከብር  አታሟርትብኝ እንጂ?	negative	amh
እሺ የሚስቶች ጠበቃ ነኝ አልሽሳ	negative	amh
ዳር ቆሞ የአንዱን ሃሳብ ከነእንከን ከማሞካሸት ወይም ከመተቸት መሃል ላይ ቆሞ የሁለቱንም አስተውሎ፣ መርምሮ እና አመዛዝኖ ከሁለቱም አሳማኝ ሃሳቦችን ወስዶ፣ አውዳሚዎችን ደግሞ ትቶ…	negative	amh
በእውነት ጾም ከባድ ነው??	negative	amh
እንጀራ በህልሜ ብቻ እና ብቻ ነው የማየው  ሆድ ባሰኝ ሲበሎ ማየት በዩቱብ በፌስ ቡክ መንደር በቃ ብዙ አመታት አስቆጠርኩኝ እንጀራየ	negative	amh
ይሄ  ባራምባራስ የባልደራስ ምርጫው እስኪያል ቢያስሩትጥሩ ነበር  ሞር ዝነኛ ይሆናል	negative	amh
እርቀቱን ለማስረዳት ልደቱን ስናይ ጽንሰቱም ልደቱም በፍጹም ድንግልና ነው። እንደዚሁም ወደ መቃብር ከወረደ በኋላ ሲነሳ ድንጋይ አስነስቶ መግነዙን ፍቱልኝ ብሎ አደለም። በታሸገ መቃብ…	negative	amh
ፕሮፌሰር ኢሊችን የአመቱ በጎ ሰው ብሎ የሸለመ ሰው ለኔ ቅቤ ያጠጣኛል ብለህ ካሰብክ ተሳስተሃል። ቢመቸው መርዝ በጥብጦ ነው የሚያጠጣህ። ለዚያ አይሁድ ፕሮፌሰር እውቅና ሰጥቶ መ…	negative	amh
ክፉ ምቀኛ	negative	amh
የትራፊኮቹን ጉቦ መቀበልና እዝላልነት በሹፌሮች ብቻ ማሳበቡ ተገቢ አይደለም	negative	amh
እቺናት እንግዴ የኛ ሃገር! ሌሎቹም ከህውሃት ጋር አብረው ሃገሪቷን ወደብ አልባ እንድትሆን ያስደረጉ ሲቀጥልም 49አመት ጫካ ውስጥ የቆዩ 1ዓመት ቢቆይ በአለም አቀ…	negative	amh
ድሮ አዲስ ነገር ላይ ስትፅፍ ጋዜጠኛ ትመስለኝ ነበር፤ ከቅርብ ግዜ ወዲህ ነው ነገረኛ መሆንህን ያወቁት ??	negative	amh
ደብዳቤ ለአቶ ልደቱና ይልቃል ማለት ብቻ ነበር የቀራቸው።	negative	amh
አብይ እነን የምሳዝነው አንተም ኦሮሞን ህዝብ ከዚህ በፊት ከከዱት ብዙ ይሁዲዎች ጋር መደመርህ ብቻ ሳይሆን አንተም ይሁዳ ሆነህ መገኘትህ ነው።  እግዝአብሐሄርም የስራህን ይ…	negative	amh
በገዛ እጄ እጣ ፈንታዬ በል ውጣ።	negative	amh
በኬኒያ የአሜሪካ ጦር ካምፕ ዛሬ በአል-ሸባብ ጥቃት ደረሰበት	negative	amh
ባሌ ሰው ጠፋ። እንደ አሜባ ተበጣጥሶ ማለቁ ነው። ከዚህ በፊት ግማሽ ወረዳዎች ወደ አርሲ ታጥፈው እንደነበር የሚታወስ ነው።	negative	amh
ደግ ነገር ስለማንውድ፣ የቀናነት ችግር ስለአለብን፣ የተዛባ ክፋት ያረቀው ግንዛቤና ደንቆሮች ስለሆን ነው እንደአህያዋ ሥጋ አመዱ ብቻ የሚያሰኘን!	negative	amh
ሞጣ ላይ  ክርስቲያኑ ሱቁን ከፍቶ ሰራውን እየሰራ ሙስሊሙ አንገቱን ደፍቶ እያለቀሰ ይገኛል!!  እንደዚህ አይነት አሳፋሪ ጎረቤት ጋር መኖር ልብን ያደማል!!	negative	amh
ድሮም እኮ ዳቦ መጥፊያችን ነው፤ ድፎ ሲሆን አስቡት ??	negative	amh
ወይ ጉድ! አውቆ አብድ ነው ባክህ	negative	amh
ለዚህ poor ገገም ድንጋይ ራስ ካለበት ፎቅ መወርወሮ ብቻ ነበር የሚገባው። Another form of TPLF.	negative	amh
Someone stop me from usin የኢትዮጵያን ጽሑፍ በመጠቀም ፡፡ ከእንግዲህ አስቂኝ አይደለም። የአንተ አካል. ይጠፋል ፡፡ ወደፊት ደም ፡፡ መፍሰስ። በተስፋ መቁረጥዎ ውስጥ…	negative	amh
መወለድ ነበረበት። ዛሬም በሃይማኖታዊ ዓለም ውስጥ የያዝነውን ስፍራና ስልጣን ወደ ጎን ትተን ወደ ጌታ ካልመጣን ዳግም ተወልደን የእግዚአብሔርን መንግስት ማየት አንችልም።	negative	amh
እኛ= እሄንን ድርጊት ከማውገዝ ይልቅ ዝምታን የመረጡ፣በተለይ ወጣቶቹ (የጢቅት ሰዎች የጥፋት ተልዕኮ ማስፈፀሚያ የሆኑ)፣ተቋሞቻችን (የተሰጣቸውን ሀገራዊ ግዴታ መወ…	negative	amh
አማርኛ እያወራን መግባባት ካልቻልንማ ምን ማድረግ ይቻላል?! ??	negative	amh
የጉራጌ ዞን ውስጥ የታሰሩ የህሊና እስረኞች ይፈቱ ብሎ አለማለት ክህደት ነው፡፡ ህዝባው ጥላቻ ነው፡፡ ለህዝብ ጥቅም መስራት እንደ ወንጀል የሚታየው ነገር ሊቆም ይገባል፡፡ ፍትህ ተጓድሎዋል ht…	negative	amh
እቺን ትልቅ ሃገር ለመምራት የተሰበሰቡት?? እነዚህ እራሳቸውን መምራት ማይችሉ ግማሾቹ አዛውንት ማቆያ፤ ግማሾቹ ፍርድ ቤት ቀርበው ላስጠፉት ነብስ መቀጣት ሲኖርባቸው ሃገር እንመራለን…	negative	amh
ከ10 ሚሊየን የማይበልጡ እና ከ60 ሚሊየን የቱ ነው የሚበልጠው ለዛ ነው አማራው የማይቀበለው እናንተ 10 ሚሊየን አናሳ ናቸው	negative	amh
ሳያልፍልን ደሞ 3ኛው የዓለም ጦርነት ሊጀመር ነው	negative	amh
እውነት ነው አባቴ  እንዲህ ተረዳድተን ፣ ተደጋግፈን በደስታውም በሀዘኑም አብረን ነው የኖርነው ; እንዳሁኑ የተማሩ ማሀይሞች የዘር እና የክልል ፖለቲካ አምጥተው መርዝ ከመርጨታቸው በፊት። ????❤	negative	amh
እሰክንድር ነጋ በኢትዮጵያ የርስ በርስ ግጭት አንዲቀጣጠልኀ ነዳጁን እያዘጋጀ ያለ ፋኖ ነው	negative	amh
ገፄን የጠለፉት ወሮበሎች ከ6 ወራት በኋላ ዛሬ የእንኳን አደረሳችሁ መልዕክት አስተላልፈውበታል። የአማራ አይቲ ባለሙያዎች ይህን አካውንት እንዳገኘው ወይም እንዲዘጋ በማድረግ እገዛችሁን…	negative	amh
የዘመኑ ኢትዮጵያዊነት እና ፌደራላዊነት አቀንቃኞች ድሮ መለስ ዜናዊ ትምክህተኛ ና ጥገኛ ካላቸው የሚለዩት በምንድን ነው?	negative	amh
ተማሪዎች ትምህርት ማቋረጥና ሞት ያሳስበናል! ከሁሉ በላይ ደግሞ የሚዲያም የመንግስትም ነገሩን በዝምታ ማለፍ ያስተዛዝባል፣ ያሳዝናል!	negative	amh
ወረኛ	negative	amh
4/7- ኢትዮ 360: የኮሮና ቫይረስን ወደኢትዮጵያ እንዲገቡ ያደረገው የጀዋርና የቄሮን ሚስጥር የያዘ ቪዲዮ በእጃችን ገብቷል:: ለሀገር ደህንነትና ሰላም ስንል ይፋ ላለማድረግ ወስንናል??????	negative	amh
የሚቶለቱለ አንዳች ይቶልትልብህ መርዝ ሰው በላ አውሬ አስመሳይ ጥፋ ከዚህ ወረኛ	negative	amh
እረ እዚህ ወረፋ እየጠብኩ የ ቡና ሴትዮዋ በስልክ ስታወራ ድምጿ ታምቡር ይበጥሳል	negative	amh
አጼ ኃይለስላሴ በምጽዋ በ1945 ዓ/ም  ያሰሩት መስጊድ የመሰረት ድንጋይ ጽሁፍ  ኦነጉ አህመዲን ጀበል ተብየው ሲወቅሳቸው  ሰምቼ ነበር ይሄን ምን ትላለህ በሉት እስቲ  መቼም ተሳስ…	negative	amh
የቀን ጅቦች ጉራ መሆን ኣለበት ?????? እንጂ ጤነኛ ኣንጎል ያለው ገንዘቡንና ስሙን እንደው ዝም ብሎ ኣያጠፋም።	negative	amh
Trump ስለ ግድቡ አንድም ነገር አላለም!ስለ ግድቡ መሆን አለበት እያወራ ያለው ሚሉት ሌሎች ናቸው።	negative	amh
አየር ላይ ተንሳፈዋል እኮ:: በትምህርት ቤቶች ውስጥ የተሰገሰጉትን የማይመረቁ ቦዘኔ ቄሮዎችን: የኦነግ/የህዋሃት አቀንቃኞችን እና የሃይማኖት አክራሪዎችን ለምንድነው መንጥረው ማያባሯቸው?	negative	amh
ጠቅላይሚኒስትሩ አገር የመምራት አቅም የላቸውም አቶ ልደቱ አያሌው	negative	amh
መሬት ላይ ባለው ሀቅ መሰረት አንድ ስህተት አይደለም መቶ ስህተት ይሰራል ማን Merera Gudina ከጁዎር ጋር በአንድ አልጋ ላይ ይተኛሉ ብሎ አሰበ። እኔ ቡልቻ…	negative	amh
መልካም ዜና ነው ክፉ አውሬ  አይልመድ ከለመደም አይውለድ ይባላል፡፡ እነዚህ ክፉ አውሬዎች መፋረድ ተገቢ ነው፡፡ ክልሉ ከጎበዝ አለቆች መጽዳት አለበት፡፡	negative	amh
የተመሠከረላት ጀግና ነች  .. እንኳን ያንቺ አይነቷን ዱቄት ስንቷን አንጰርጵራለች	negative	amh
ታይምስ ሚዲያ… ሰሞነኛ ጉዳዮች! ****************************** “… ኦፌኮ የጃዋር ጥፋት ማስፈጸሚያ ካባ ነው የሚሆነው፤  ኦሮሚያ ልዩ ፖሊስ የተዘጋጀው ለምርጫው ነው… ”…	negative	amh
ልክ ብለሃል። እኛማ ተተብትበናል።	negative	amh
‹‹አእምሮን በተገደበ ነፃነት ውስጥ ማንቀሳቀስ ትርፉ ባርነት ነው››	negative	amh
ኩራት ወንድምን በመግደል ፥ በማሰር ፥ በማሰቃየት እና ሀገር በመዝረፍ ሆነ እንዴ?	negative	amh
